idx,desc
165,새로운 여행을 시작하며 설렘과 불안 속에서 사람들을 만나 꿈과 사랑을 찾아가는 이야기
166,"끝없는 축제와 무대 위에서 혼돈과 환희가 뒤섞이며, 시간과 현실을 초월해 자유롭게 춤추는 인간들의 열정이 흐른다."
167,"사랑과 죄책감이 뒤얽힌 관계 속에서 서로를 재판하듯 갈등하고, 결국 영원히 상대를 지키겠다는 절절한 결심을 담은 곡이다."
168,"새로운 시작을 향한 갈망과 용기로, 진정 원하는 것을 찾아 나아가며 밝은 내일을 향해 전진한다."
169,삶의 혼란 속에서도 함께 꿈을 찾아 나아가며 희망과 열정을 나누는 이야기
170,"오랜 전쟁이 잠시 멈추고, 서로 다른 정의를 가진 이들이 한밤에 친구처럼 노래하고 춤추며 평화와 사랑을 나누는 순간이다."
171,새로운 만남과 자유로운 어울림 속에서 즐거움과 사랑을 나누는 활기찬 여정
172,꿈을 모아 모험을 떠나는 주인공이 어려움을 기회로 삼아 친구와 함께 앞으로 나아간다.
173,일상의 경계를 허물고 무한한 상상과 즐거움 속에서 자유롭게 뛰어노는 모습을 그린다.
174,사랑을 갈구하지만 스스로의 무력함과 혼란에 사로잡혀 허무함을 느끼는 갈등적인 심정.
175,포기하지 않고 서로를 격려하며 천천히 함께 성장해 나가자는 따뜻한 희망과 위로의 메시지
176,"새로운 시작을 향한 설렘과 용기로 가득 찬, 밝은 미래를 향해 나아가는 이야기."
177,"우리는 미지의 길을 달리며 성장 속에 변치 않는 소중함을 깨닫고, 결국 모든 것을 웃으며 받아들이는 이야기를 그린다."
178,함께 나아가며 어려움을 극복하고 자유롭게 꿈을 향해 달려가는 열정적인 여정
179,과거의 갈등과 고통을 딛고 스스로를 새롭게 색칠하며 앞으로 나아가려는 결심과 희망을 담고 있다.
180,불안과 불확실한 미래 속에서 변화를 갈망하며 희망을 찾고자 하는 마음이 담겨있다.
181,"이 곡은 힘겨운 일상과 사랑을 통해 느끼는 좌절과 아픔을 담고 있지만, 그 속에서 긍정적인 마음가짐과 앞으로 나아가려는 의지를 표현하고 있다."
182,"곡은 자신의 꿈과 희망을 향해 전진하는 강한 의지와 결심을 담고 있으며, 어려움과 아픔을 겪더라도 절대 포기하지 않고 앞으로 나아가는 내용을 담고 있다."
183,두려움을 품은 첫 만남이 서로를 믿으며 점차 마음을 열어가며 사랑과 성장으로 피어나는 과정이다.
184,"아름다운 세상을 향한 희망과 자유를 믿으며, 함께라면 무엇이든 이룰 수 있다는 자신감으로 나아가는 이야기."
185,희망과 절망 사이에서 서로에게 기대며 눈물과 웃음이 교차하는 고통 속에서도 앞으로 나아가려는 갈망과 결심을 담은 이야기이다.
186,함께 꿈을 향해 달려가며 희망과 열정을 품은 여정을 노래한다.
187,자신을 깨우고 서로에게 힘이 되어 빛을 향해 나아가는 과정에서 희망과 용기를 품는 이야기
188,"두 사람은 서로의 손을 잡고 두려움을 딛고 함께 빛나는 미래를 향해 나아가며, 희망과 용기의 여정을 그린다."
189,소중한 사람에게 전하는 따뜻한 사랑과 감사의 마음이 가득한 행복한 순간을 노래한다.
190,자신을 믿으며 사랑하는 사람과 함께 밝은 미래를 향해 꿈을 이루어가려는 희망과 결연함을 노래한다.
191,"우리는 눈물과 어둠을 딛고 포기하지 않으며, 희망을 품고 날아오르는 과정을 그린다."
192,우리는 서로를 믿으며 어둠을 딛고 희망과 용기로 새로운 미래를 향해 나아간다.
193,서로의 마음을 노래하며 어려움을 딛고 함께 새로운 희망의 풍경을 만들어 나가는 이야기
194,"서로에게 힘이 되어 함께 나아가며, 희망과 용기로 새로운 자유를 향해 나아가는 이야기"
195,"함께하는 이들의 따뜻한 사랑과 기쁨이 가득한 크리스마스 밤, 서로를 선물처럼 여기며 기적 같은 행복을 나눈다."
196,자신을 믿고 사랑하는 이와 함께 두려움을 떨쳐내며 꿈을 향해 높이 날아오르는 용기와 희망의 여정이다.
197,절망과 고통을 딛고 포기하지 않는 결심과 희망으로 미래를 향해 나아가는 모습을 그린다.
198,"절망과 혼란 속에서도 스스로를 믿으며 앞으로 나아가, 희망과 자유를 찾아 나아가는 여정이다."
199,새로운 시작을 믿고 고통과 기쁨을 품으며 용기 있게 앞으로 나아가는 성장의 이야기이다.
200,꿈과 마법 같은 순간을 통해 떠나는 이에게 따뜻한 희망과 그리움을 전한다.
201,어둠을 지나 빛을 맞이하며 서로의 비밀과 약속 속에서 따뜻한 연대와 희망을 되새기는 이야기.
202,"불안과 혼란을 딛고 스스로의 빛을 찾아 나아가며, 서로에게 감사와 용기를 나누는 과정에서 우리는 끊임없이 변화하고 성장한다."
203,자신을 믿고 한 걸음씩 나아가며 꿈과 희망을 향해 전진하는 용기와 성장의 이야기를 담고 있다.
204,절망과 상처 속에서 자신을 되찾아 자유와 새로운 시작을 향해 나아가는 갈망과 결단을 담은 이야기이다.
205,아픔과 후회를 안고도 새로운 시작을 향해 스스로의 길을 열어가려는 갈망과 수용의 이야기이다.
206,"자신만의 가치를 인정하고, 남들의 기대와 갈등 속에서도 포기하지 않으며 자유롭게 살아가려는 갈망을 담은 곡이다."
207,다른 사람들과의 차이를 부정하고 외로움에 시달리다 결국 자신을 받아들이고 새로운 빛을 찾는 여정이다.
208,"자신을 잃어가면서도 포기하지 않고, 어두운 현실 속에서 희망을 찾아 나아가는 이야기."
209,"끝없이 도는 회전목마 같은 삶 속에서 자신을 부정하고 갈등하며, 희망과 절망 사이를 오가며 정체성을 찾아가는 고통스러운 여정이다."
210,"절대 포기하지 않겠다는 다짐과 꿈을 향한 용기, 그리고 스스로를 믿으며 자유를 찾아 나아가는 이야기"
211,"서로에게 진심을 전하며 성장하고, 따뜻한 사랑과 감사 속에서 새로운 세계를 함께 만들어가는 이야기다."
212,"30대의 혼란과 외로움 속에서도 유일한 기적을 꿈꾸며, 이루지 못할 약속들을 안고도 아름다움을 향해 날아오르는 갈망과 희망을 담은 노래이다."
213,"고통과 시련을 딛고 서로의 빛으로 함께 나아가며, 새벽을 믿는 희망과 사랑으로 새로운 미래를 향해 날아오르는 이야기이다."
214,"수많은 시련과 기억을 딛고, 아픔을 따뜻한 힘으로 바꾸며 희망과 용기로 새로운 빛을 향해 나아가는 이야기이다."
215,"어둠과 갈등을 마주한 채 서로의 의지를 합쳐, 스스로의 꿈과 빛을 향해 끊임없이 전진하는 이야기"
216,고난을 딛고 스스로의 빛을 믿으며 앞으로 나아가는 용기와 희망을 노래한다.
217,"끝없는 어둠 속을 헤매다 감사와 희망을 품고 스스로를 믿으며 앞으로 나아가, 소중한 사람들과 세상을 지키겠다는 결심을 다지는 이야기이다."
218,"우리는 서로의 끈으로 어려움을 이겨내며, 포기하지 않는 결심으로 밝은 미래를 향해 함께 나아간다."
219,주인공은 지루함과 운명에 맞서 사랑과 자유를 찾아 함께 날아오르려는 갈망과 그 끝을 향한 애틋한 슬픔을 품는다.
220,"삶의 혼란과 고통 속에서 자신을 이해받고자 갈망하며, 결국 포기하지 않고 꿈을 향해 나아가려는 결심을 다지는 이야기이다."
221,힘든 현실 속에서도 친구와 꿈을 지키며 스스로의 가치를 찾아 자유롭게 세상을 바꾸려는 결심을 노래한다.
222,"눈부신 감정에 눈을 돌리며 말 못할 외로움을 품은 채, 약함을 인정하고 함께 나아가려는 갈망과 희망을 품는다."
223,"자신의 선택으로 운명을 개척하고, 함께 싸워 나가겠다는 결심과 희망을 품은 이야기"
224,"스스로를 파멸로 몰아가면서도, 함께하는 순간에 위안을 찾으려는 갈망과 절망이 뒤섞인 이야기."
225,과거의 상처와 불안 속에서도 자신과 타인을 향한 희망을 찾아 색을 입히며 앞으로 나아가는 이야기
226,"자신의 감정을 솔직히 받아들이고, 끊임없는 변화를 통해 자유롭게 앞으로 나아가며 슬픔과 사랑을 포용하는 이야기."
227,우리는 서로 손을 잡고 불확실한 미래를 향해 용기와 희망을 품으며 나아간다.
228,자신만의 이야기를 찾아 나아가며 절망을 딛고 희망과 열정을 품는 여정이다.
229,"주인공은 사랑하는 이와 함께 날아오르며 어려움을 이겨내고, 평화와 희망을 향한 용기와 애틋함을 품는다."
230,끝없는 고통과 기억의 소용돌이 속에서 절망과 외로움을 안고도 끊임없이 벗어나려는 주인공의 투쟁을 그린 이야기.
231,"과거의 슬픔을 품은 채 사랑과 자유를 갈망하며, 결국 떠나보내는 결단을 내리는 이야기."
232,순수한 마음으로 꿈을 그리며 두려움 없이 희망을 향해 나아가는 성장과 열정의 이야기이다.
233,"자신이 부서진 존재임을 깨달은 채, 사랑하는 이를 잃지 않으려 애쓰면서도 진실을 찾고 파괴와 구원의 사이에서 갈등하는 이야기"
234,"끝없는 여행과 자기 탐색 속에서 소중한 사람을 만나 사랑을 갈구하지만, 여전히 고독과 빛나는 희망이 교차하는 이야기이다."
235,주인공은 갈망을 잡고 소리치는 세상에 뛰어들어 고통과 불안을 딛고 새로운 자신으로 다시 태어나려는 결심을 다진다.
236,"자신을 증오하고 후회와 절망에 빠진 채, 모든 희망을 포기한 채 스스로를 파멸로 몰아가는 절망적인 여정이다."
237,"두 사람이 서로의 불완전함을 인정하고, 서로를 사랑하고 받아들이는 과정을 표현하는 노래이다."
238,"이 세계는 처음부터 오류와 혼란으로 가득 차 있으며, 개인의 자유와 행복을 추구하는 것이 중요하다는 메시지를 전하는 곡이다."
239,"이 곡은 삶의 무한한 가능성과 도전을 받아들이며, 실패와 고통을 통해 성장하고 새로운 세계를 열어가는 과정을 표현한다."
240,서로 다른 마음을 조율하며 이해와 사랑을 찾아가려는 두 사람의 갈망과 희망이 담긴 이야기.
241,함께 새로운 세상을 향해 나아가며 꿈과 행복을 찾아 성장하는 여정을 그린다.
242,"시간의 한계 속에서도 서로 다른 세계를 살아가는 사람들과의 연결을 갈망하며, 웃음 뒤에 숨은 고통을 이겨내고 포기하지 않으려는 희망적인 투쟁을 그린다."
243,끊임없는 노력과 자신감으로 한계에 도전하며 모두를 격려하는 열정적인 훈련의 이야기다.
244,그들은 어두운 교실과 사회의 틀에 갇힌 절망 속에서도 서로의 외침을 모아 반항과 희망을 외치며 자유와 자기 실현을 향해 일어선다.
245,과거의 외로움을 떠올리며 지금도 서로를 이해하는 특별한 교감 속에서 위로와 희망을 찾는다.
246,"오랫동안 혼자 살아온 주인공이 자신을 받아주고 변화시켜 주는 존재를 만나, 절망과 외로움을 딛고 새로운 빛과 희망을 찾아 나아간다."
247,"삶의 압박과 무의미함을 마주하면서도 새로운 나를 찾아 나아가, 아름다움과 희망을 믿는 갈망이다."
248,자신을 억누르는 현실과 기대 속에서 혼란스러워하면서도 타인과의 진정한 이해와 소통을 갈망한다.
249,"불안과 갈망 속에서 스스로를 다잡아 이상을 향해 달려가며, 좌절을 빛으로 바꾸는 과정이다."
250,"어두운 도시와 파편 같은 삶을 배경으로, 불완전한 세상의 아름다움을 찾아 끊임없이 재시작하며 절망 속에서도 희망과 사랑을 갈구한다."
251,"반복되는 풍경 속에서 자신을 찾지 못한 채 고독과 불안을 안고, 따뜻한 연결을 갈망하지만 두려움에 사로잡힌다."
252,"인간의 억압과 허무함을 벗어나 동물 같은 단순함과 자유를 갈망하며, 혼란 속에서도 일시적인 해방을 찾아 떠도는 모습을 그린다."
253,무대 위에서 가면을 쓰고 살아가며 정체성을 잃은 채 진실된 자신을 찾고 싶어 하는 고통과 갈망이 뒤섞인 이야기
254,외로움과 불안 속에서 사랑과 인정을 갈구하며 스스로를 극복하려는 갈망을 품은 혼란스러운 자아의 이야기이다.
255,가상과 현실 사이에서 자신을 잃은 채 허위와 억압에 반항하며 진정한 자아를 찾아 탈출하려는 갈망을 표현한다.
256,무한한 가능성을 갈망하지만 정체성과 사회적 압력에 혼란스러워하며 자유와 자기 주장을 찾아 헤매는 모습
257,혼란한 우주 속에서도 자유롭게 살아가며 새로운 가능성을 기대하는 밝고 장난스러운 마음
258,"혼란한 현실 속에서 의미와 연결을 갈구하지만, 결국 고독과 무력감에 사로잡힌 채 방황한다."
259,부조리와 고독에 짓눌리면서도 포기하지 않고 앞으로 나아가려는 갈망을 담고 있다.
260,"혼자서 방황하며 의미를 찾으려는 과정을 담은 노래로, 주변의 소음과 혼란 속에서 자신의 목소리를 내고자 하는 갈망이 느껴진다."
261,"비가 그칠 때까지 기다리지 말고, 지금 이 순간을 소중히 하며 앞으로 나아가자는 메시지를 담은 노래이다."
262,힘들고 어려운 상황에서도 서로를 지지하고 응원하며 함께 살아가는 것의 중요성을 강조하는 노래이다.
263,"주인공은 우울과 혼란에 사로잡힌 채, 모든 것을 잊고 자유롭게 떠다니는 춤을 통해 새로운 시작을 갈망한다."
264,"주변에 있어도 눈치채지 못하는 자신을 드러내려 애쓰며, 음악으로 모든 감정을 울려 퍼뜨려 인정받고 싶어한다."
265,"지하 터널 같은 어두운 내면에서 끊임없는 불안과 고통에 사로잡히지만, 스스로를 받아들이고 사랑하려는 갈망으로 나아가는 이야기이다."
266,"외로움과 불안 속에서 누군가와의 따뜻한 연결을 갈망하며, 스스로를 믿고 앞으로 나아가려는 갈등과 희망을 품는다."
267,"차가운 고독 속에서 절망과 갈망을 품던 나는, 사랑과 위로를 만나 비록 아프지만 따뜻한 희망을 되찾는다."
268,"멀리 떨어진 세상 속에서 자신을 잃어버린 듯한 절망과 갈등을 겪지만, 사랑하는 이와의 소중한 연결을 포기하지 않으려는 간절한 갈망과 희망을 품는다."
269,방황과 상처 속에서도 포기하지 않고 서로에게 기대며 앞으로 나아가는 이야기.
270,"주인공은 목적을 찾지 못한 채 방황하며 공허와 절망 속에서도 자신만의 힘을 갈구하고, 결국 누군가와의 울림을 통해 존재의 의미를 엿보는 여정을 그린다."
271,"정체성에 대한 불확실함 속에서도 현재의 작은 빛을 붙잡고, 진정한 나로 살아가려는 결심을 다지는 이야기"
272,불안과 허무함에 사로잡힌 채 스스로를 위로하고 받아들이려는 갈망이 엿보인다.
273,"상처받은 몸과 마음으로도 멈추지 않고, 자신만의 속도로 한 걸음씩 나아가며 따뜻한 인간미와 희망을 찾아가는 이야기."
274,불안과 방황 속에서도 멈추고 다시 일어서는 용기를 찾아 내일을 믿으며 나아가는 이야기다.
275,"자신이 다른 존재임을 느끼면서도 무리 속에 끼워져 허무와 고통을 겪으며, 결국 스스로를 잃은 채 외로움과 절망에 빠지는 과정을 그린다."
276,"주인공은 길을 잃은 채 절망과 불안 속에서도 끊임없이 탈출과 구원을 갈구하며, 어두운 현실 속에서 희미한 연결을 찾아 나아간다."
277,우리는 서로의 발걸음을 맞추며 길을 헤매다 결국 자신을 돌아보고 작은 희망과 자부심을 품은 채 앞으로 나아간다.
278,"외로운 나는 두려움과 정체 속에서 끊임없이 나아가려 애쓰며, 서로의 심장소리에 귀 기울여 함께 존재하고자 하는 갈망을 품는다."
279,"구름에 가려 앞길을 알 수 없는 채, 끊임없는 후회와 갈망에 사로잡혀 정체된 채 살아가는 모습이다."
280,"포기와 후회 속에 자신을 숨기며 어두운 고독을 견디는 가운데, 용서와 해방을 갈망한다."
281,"주인공은 흐릿한 슬픔과 깨진 약속에 사로잡혀 떠날 수 없는 절망 속에서 자신을 잃어가며, 결국 사라지는 듯한 허무함을 마주한다."
282,"깊은 어둠 속에서 자신만의 외침과 눈물로 존재를 탐색하며, 잃어버린 과거와 닿을 수 없는 미래 사이에서 희망을 찾아 나아가는 고독한 여정이다."
283,"과거와 다른 오늘을 마주하며, 길을 잃은 듯한 혼란 속에서도 친구와 함께 불멸의 노래와 뜨거운 열정을 잡고 어둠을 향해 나아가는 이야기."
284,"상처받은 과거와 불확실한 미래에도 서로의 손을 놓지 않고, 음악으로 서로를 비추며 앞으로 나아가는 결연한 희망과 연대의 이야기."
285,"과거의 죄와 상처를 지우려 애쓰며 스스로를 용서하지 못하던 주인공이, 고통을 마주하고 받아들여 점차 성장해 나가는 과정이다."
286,두려움과 혼란 속에서도 진심을 전하려는 갈망과 스스로를 지키려는 고독한 결심이 교차한다.
287,"멈추지 않는 충동과 불완전함을 힘으로 삼아, 스스로의 길을 찾아 나아가는 갈망과 결연함이 뒤섞인 이야기다."
288,진정한 감정을 찾으며 방황하는 화자는 약속은 사라져도 그리움과 희망을 품고 사랑하는 이와의 가까움을 갈망한다.
289,"사라지지 않으려 애쓰는 따뜻한 감정 속에, 서로에게 기대며 쌓여가는 그리움과 애틋함을 노래한다."
290,"불확실한 길을 헤매며 상처와 두려움을 품지만, 사랑과 연결을 찾기 위해 앞으로 나아가는 갈망과 희망을 노래한다."
291,깨지기 쉬운 방어를 허물고 불안한 경계 위에서 상대에게 다가가려는 갈망과 용기를 품은 여정이다.
292,"삶과 죽음 사이에서 사랑과 절망을 마주하며, 존재의 의미를 찾고 살아가려는 갈망을 품는다."
293,"주인공은 가속을 밟아 거리와 시간을 뚫고, 그 대상에게 다가가려는 절박한 열정과 갈망을 노래한다."
294,변함없는 부패의 도시에서 포기하고 싶지만 스스로 손을 내밀어 살아가려는 절망과 저항의 여정이다.
295,잊힌 사랑과 상처를 안고 과거를 되돌아보며 존재의 의미를 찾으려는 절절한 갈망과 슬픔이 뒤섞인 이야기.
296,"남을 구하고 싶어도 자신의 무력함을 깨달으며, 결국 스스로와 타인의 고통을 받아들이는 과정을 그린다."
297,"세상의 허위와 모순 속에서 타인에게 인정받으려는 압박에 지쳐, 소중한 사람과 진정한 연결을 갈망하지만 깊은 절망과 무력감에 사로잡힌다."
298,과거의 선택을 후회하며 자신을 용서하지 못하는 주인공이 어두운 고통 속에서도 빛을 찾아 나아가려는 갈망과 절망을 동시에 품는다.
299,"시간 속에서 숨을 이어가며 타인에게 기대지만, 지지와 감정이 사라지는 고독과 내면의 고통 속에서 의미와 위안을 찾으려 애쓰는 모습이다."
300,외로운 마음이 절망 속에서도 작은 빛을 찾아 사랑을 붙잡으려는 갈망을 그린다.
301,"이 곡은 꿈을 추구하고, 실패를 두려워하지 않으며, 함께하는 것의 중요성을 강조하는 메시지를 전달한다."
302,"이 곡은 도전과 실패를 거치며 자신감을 얻고, 다시 도전하는 과정을 담고 있으며, 결국에는 성공과 자신감을 얻는 이야기를 다루고 있다."
303,"이 곡은 사랑과 그리움, 그리고 혼자서 앞으로 나아가는 과정을 담고 있으며, 주인공은 자신의 마음을 표현하고 상대방에게 닿으려는 노력을 하지만 쉽게 이루어지지 않는다."
304,"지친 마음 속에서도 희망의 빛을 믿으며, 포기하지 않고 다시 일어나 새로운 길을 향해 나아가는 결심을 다진다."
305,"햇살 가득한 여름날, 친구와 함께 자유롭게 즐기며 행복과 설렘을 만끽하는 이야기"
306,우리는 포기하지 않고 서로를 믿으며 꿈과 사랑을 향해 전진한다.
307,"그 사람을 바라볼 때마다 탄산처럼 설레고 달콤한 마법에 휩싸여, 행복과 두근거림이 뒤섞인 황홀한 순간을 경험한다."
308,"사랑과 노력을 통해 자신을 갈고닦아 새로운 무대로 나아가며, 긍정과 부정을 모두 힘으로 삼아 꿈을 향해 전진하는 이야기"
309,힘겨운 일상 속에서도 포기하지 않고 꿈을 향해 피어나며 나아가는 소녀의 결연한 의지와 희망을 노래한다.
310,함께 힘을 모아 어려움을 이겨내며 밝은 미래를 향해 나아가는 이야기
311,"함께 힘을 모아 포기하지 않고 계속 일어나며 성장하고, 서로에게 행복과 용기를 전하는 밝은 희망의 여정이다."
312,어두운 시련이 찾아와도 따뜻한 위로와 스스로의 용기로 앞으로 나아가 밝은 미래를 향한 희망을 품는 이야기.
313,함께 힘을 모아 어려움을 이겨내며 꿈을 향해 나아가는 희망찬 여정이다.
314,힘든 시련 속에서도 서로를 격려하며 포기하지 않고 함께 앞으로 나아가는 모습을 그린다.
315,자신만의 특별함을 받아들이며 환상적인 세계에서 설레는 사랑과 즐거움을 만끽한다.
316,혼란스러운 감정 속에서도 포기하지 않고 사랑과 즐거움을 찾아 활기차게 나아가는 이야기
317,자신이 겪는 불안과 자책을 딛고 사랑과 용기를 찾아 스스로를 받아들이려는 갈망이 담긴 곡이다.
318,키와 나 사이의 따뜻하고 즐거운 유대감이 영원히 이어지는 행복한 순간들을 노래한다.
319,자신만의 정체성을 찾아 자유롭게 살아가며 스스로를 즐기고 믿음으로 성장하는 이야기
320,자신을 있는 그대로 받아들이고 어려움을 이겨내며 삶의 가치를 찬양하고 끊임없는 도전과 자부심을 격려한다.
321,함께 꿈을 안고 새로운 세계를 향해 용기 있게 나아가는 여정이다.
322,함께 힘을 모아 꿈을 향해 나아가며 두려움 없이 서로를 격려하고 성장한다.
323,"소중한 사람에게 감사와 사랑을 전하며, 변함없는 인연으로 함께 밝은 미래와 행복을 꿈꾸는 이야기다."
324,"시간과 기억이 사라지는 허무함 속에서도 감사와 사랑을 품고, 떠오르는 불꽃처럼 새로운 시작을 향해 용기 있게 나아가는 이야기이다."
325,"사랑의 설렘과 상처가 뒤섞인 채, 잊힌 기억과 채워지지 않는 허전함 속에서 갈망과 슬픔을 품은 이야기다."
326,연인과 함께 새로운 행복을 향해 달려가며 설렘과 사랑을 간직한 갈망이다.
327,평범한 일상에 싫증을 느끼던 주인공이 친구들과 함께 모험을 떠나며 꿈과 희망을 찾아가는 이야기이다.
328,"이 곡은 애타는 마음과 서운한 감정을 가진 화자가, 마음이 다른 사람에게 빼앗긴 것 같은 상대를 향한 애절한 마음을 표현하고 있다."
329,이 곡은 주인공이 자신의 삶을 즐기며 친구들과 함께 춤추고 변화하는 과정을 통해 성장과 자유를 추구하는 내용이다.
330,"이 곡은 사랑과 자아 발견을 통해 행복을 추구하며, 끊임없이 변화하고 성장하는 삶의 여정을 노래한다."
331,"이 곡은 일상의 소소한 즐거움과 고민, 그리고 다가오는 변화에 대한 설렘과 기대를 노래하며, 그 속에서 느끼는 감정의 기복과 성장을 향한 열망을 표현한다."
332,"이 곡은 혼자가 아닌 함께하는 희망과 성장을 노래하며, 두려움을 극복하고 미래의 가능성에 기대를 걸며 긍정적인 에너지를 추구하는 여정을 담고 있다."
333,불완전한 관계 속에서 외로움과 불안감을 느끼며 누군가를 그리워하고 염원하는 서정적 자아의 이야기
334,"이 곡은 멀리 떨어져 있는 사랑하는 사람에게 하고 싶은 말이 있지만, 직접 찾아가거나 만나러 갈 수 없어서 마음이 답답하고 아파하는 감정을 표현하고 있다."
335,이 곡은 자유와 아름다움을 추구하며 미래를 향해 나아가는 희망과 열망을 노래한다.
336,이 곡은 불확실한 미래에 직면하여 두려움과 걱정을 안고서라도 끊임없이 도전하고 성장해 나가려는 의지와 희망을 표현하고 있다.
337,"이 곡은 불확실성과 어려움을 극복하고 앞으로 나아가며, 포기하지 않고 진정성 있는 자신의 모습을 잃지 않으려는 의지와 희망을 표현하고 있다."
