idx,desc
338,"이 곡은 끊임없는 도전과 노력을 통해 자신의 가능성을 믿고 앞으로 나아가며, 어려움을 극복하고 성장하는 과정을 노래한다."
339,"행복한 추억과 그리움을 간직하며, 사랑하는 사람과 함께 걸어가는 삶의 소중함을 노래한다."
340,"이 곡은 끊임없는 도전과 성장을 통해 함께 걸어온 과거를 돌아보고, 미래에 대한 희망과 감사를 표현하며, 포기하지 않고 꿈을 향해 나아가는 이야기를 전한다."
341,"이 곡은 꿈을 이루고자 하는 열망과 불안, 그리고 친구들과 함께 행복을 추구하며 성장하는 과정을 노래한다."
342,"이 곡은 자기 자신을 사랑하고 자유롭게 살아가는 삶의 기쁨과 행복을 표현하며, 자신을 사랑하고 자신을 위해 사는 것의 중요성을 강조한다."
343,"행복과 사랑을 갈망하는 마음이 담긴 이 곡은, 서로를 그리워하고 기다리며 특별하고 행복한 순간들을 공유하고자 하는 두 사람의 이야기이다."
344,"이 곡은 자신의 크고 작은 경험과 감정을 돌아보며, 자신의 인생을 긍정적으로 받아들이고 미래를 향해 나아가는 희망과 자신감을 노래한다."
345,성장과 이별의 아쉬움을 느끼며도 끊어지지 않는 연결을 추구하는 마음을 노래한다.
346,이 곡은 두 사람이 운명적으로 끌려가고 서로에게 빠져드는 과정을 통해 진정한 사랑과 현실을 받아들이는 여정을 노래한다.
347,"깊은 밤 도쿄의 작은 공간에서 꿈을 꾸던 주인공은 현실의 허무함과 고독을 느끼며, 결국에는 모든 것이 사라질 것이라는 자각 속에서 현재를 즐기기로 한다."
348,"이 곡은 힘든 상황을 겪으며 스스로를 증명하고, 자신의 꿈을 향해 나아가는 과정을 통해 희망과 용기를 얻는다는 내용을 담고 있다."
349,"외향적인 삶과 자신감의 성취를 갈망하며, 진정한 지지자와의 연결을 통해 두려움을 극복하고 자신의 가치를 인정받는 여정."
350,"이 곡은 인간의 감정과 사랑을 다양한 이미지를 통해 표현하며, 일상의 소중함과 영원한 사랑을 추구하는 서사를 담고 있다."
351,"이 곡은 이별 후에도 여전히 사랑과 관심을 갈구하고, 이로 인해 더욱 아름답고 자신감 있는 모습으로 거듭나는 여자의 이야기로, 감정적으로는 아픔과 외로움, 용기, 자아성장을 경험하는 서사를 담고 있다."
352,이 곡은 사랑에 빠진 두 사람이 서로를 그리워하며 설렘과 행복을 느끼는 과정을 그린다.
353,"일상 속에서 사랑하는 사람과 소통하고자 하는 마음과 그로 인한 설렘, 두려움, 그리고 행복을 경험하며 성장하는 서사를 그리고 있다."
354,"마법 소녀가 되는 것이 가져다주는 겉과 속의 괴리에 괴로워하며, 마법 소녀를 그만두고 싶어 하는 마음과 그러한 기대에 부응해야 한다는 압박감에 대한 곡이다."
355,"이 곡은 자신을 사랑하고 즐기며 살아가는 것에 대한 자부심과, 그런 자신을 비난하는 타인에 대한 반항심을 표현하고 있다."
356,이 곡은 누군가를 기다리며 고통과 자괴감에 빠진 한 남자의 내적 갈등과 상실감을 표현한다.
357,이 곡은 약자와 소외된 이들을 위로하고 그들을 위해 싸우며 그들과 함께하겠다는 의지와 사랑을 표현하고 있다.
358,"이 곡은 누군가를 향한 깊은 이해와 공감을 바탕으로, 힘든 현실을 함께 극복하고 진정한 자아를 찾아가는 여정을 노래한다."
359,완벽한 외면을 가진 아이돌이 자신의 비밀을 숨긴 채 사랑과 욕망의 감정을 탐구하며 진정한 사랑과 자아를 찾아가는 과정
360,"여름의 끝과 함께한 두 사람의 꿈과 희망, 그리고 영원한 이별과 그리움을 통해 시간과 공간을 초월한 깊은 우정의 감정을 되돌아본다."
361,이 곡은 누군가를 사랑하지만 거리감이 느껴져서 마음속으로만 그 사람과 가까이하고 싶어 하는 감정을 표현하고 있다.
362,"이 곡은 사랑과 그리움, 그리고 미래에 대한 희망을 노래하며, 마음속 감정과 사랑의 중요성을 강조한다."
363,복잡하고 불안한 마음을 가진 두 사람이 서로의 감정을 나누고 진솔하게 다가서려는 노력과 사랑을 표현하는 곡
364,복잡하고 불안한 마음으로 사랑하는 사람과 가까이 있고 싶은 욕망과 그로 인한 감정의 혼란을 경험하며 결국 진정한 사랑을 표현하고 싶은 마음을 터뜨리는 과정이다.
365,"이 곡은 사랑하는 사람에게 마음을 제대로 표현하지 못해 괴로워하는 감정을 중심으로, 사랑과 그리움, 그리고 표현하지 못한 마음의 복잡함을 서술한다."
366,"사랑하는 사람과의 만남을 갈망하며, 끊임없이 반복되는 일상과 감정 속에서 사랑의 존재를 느끼는 서사"
367,"이 곡은 사랑의 복잡한 감정과 상실, 그리고 성장의 과정을 통해 사랑에 빠진 세상의 아름다움과 고통을 표현하고 있다."
368,"이 곡은 과거의 아픈 기억과 사랑을 그리며, 진솔한 감정을 전자음으로 전달하고, 상처받은 마음을 달래주는 희망과 위로의 메시지를 전한다."
369,"이 곡은 불완전한 현실과 이상 사이의 괴리에 대한 자각과 좌절, 그리고 그 속에서 진정성 있는 가치를 찾아가는 서사를 그리고 있다."
370,이 곡은 자신만의 개성을 중시하며 이상적인 미래를 향해 친구들과 함께 도전하고 성장하는 과정을 통해 꿈을 이루는 이야기를 전달합니다.
371,"이 곡은 새로운 시작과 성장을 추구하며, 희망과 기쁨을 노래하고, 친구와 함께 즐거운 시간을 보내고 싶은 마음을 표현한다."
372,이 곡은 사랑과 상실의 감정을 통해 두 사람이 서로를 의지하며 어려움을 극복해 나가는 과정을 그린다.
373,"이 곡은 죽음과 꿈에 대한 열망을 표현하며, 어려운 운명에도 굴하지 않고 앞으로 나아가는 이야기를 통해 희망과 절망을 대비적으로 보여준다."
374,"이 곡은 사랑에 대한 갈망과 설렘을 배경으로, 주인공이 자신의 감정을 깨닫고 표현하는 과정을 그린다."
375,"이 노래는 밝고 활기찬 분위기에서 꿈과 사랑을 향한 열망과 설렘을 표현하며, 주인공은 자신의 마음을 열고 앞으로 나아가기 위해 용기를 내는 과정을 담고 있다."
376,과거의 아픔을 딛고 새로운 희망을 찾아 앞으로 나아가는 과정에서 사랑과 용기를 전달하고자 하는 마음이 담겨 있다.
377,"앞으로의 길에 대한 불안과 두려움을 느끼지만, 함께할 수 있는 사람과 꿈을 향해 나아가는 희망과 결심이 담긴 노래이다."
378,좌절과 희망 사이를 오가는 청춘의 복잡한 감정이 뒤얽힌 성장의 서사를 노래한다.
379,꿈과 희망을 노래하며 성장과 우정을 추구하는 청춘의 이야기가 감동과 열정으로 가득하다.
380,"꿈과 희망을 노래하며 성장하는 과정에서의 설렘과 불안, 그리고 극복을 통해 우정과 사랑을 발견하는 이야기"
381,"이 곡은 사랑하는 사람과의 관계에서 느끼는 다양한 감정들을 섬세하게 표현하며, 그 속에서 피어나는 사랑과 연결의 아름다움을 노래한다."
382,"이 곡은 꿈을 포기하지 않고 끊임없이 전진하며, 어려움을 겪더라도 결국에는 밝고 희망찬 미래가 기다리고 있음을 표현하고 있다."
383,"이 곡은 꿈을 향해 나아가는 과정에서의 설렘과 행복, 그리고 그 꿈을 이룰 때까지의 여정을 그리며, 희망과 긍정적인 감정으로 가득 차 있다."
384,이 곡은 성장과 변화의 과정을 통해 자신과 미래를 향해 나아가는 청춘의 이야기이다.
385,이 곡은 미래를 바꾸고 싶어하는 두 사람이 함께 걸으며 어려움을 극복하고 자신의 꿈을 향해 달려가는 이야기이다.
386,"밤하늘을 수놓는 별빛처럼 타오르는 감정과 끊임없는 열망 속에서, 꿈을 향해 달려가는 삶의 속도감을 경험하며 희망을 잃지 않으려는 내적 갈등과 성장의 이야기를 표현한다."
387,"이 곡은 두 사람이 운명처럼 만나기 전과 후에 대해 그리며, 과거의 모든 순간을 감사히 여기고 미래를 향해 나아가는 희망찬 서사를 그린다."
388,"크리스마스 파티를 준비하며 모두가 함께 즐기고 사랑을 나누는 가운데, 한 사람이 모든 것을 변화시키고 마법 같은 밤을 만들어낸다는 내용의 곡이다."
389,"이 노래는 두 사람이 함께 꿈을 모아 앞으로 나아가며, 서로의 마음을 연결하고 사랑과 열정을 통해 어려움을 극복하며 미래를 향해 나아가는 이야기를 전달합니다."
390,"이 노래는 꿈과 희망을 공유하며 서로를 지지하고, 하나로 뭉쳐 세계를 긍정적으로 변화시키고자 하는 메시지를 전달한다."
391,과거의 추억과 현재의 설렘을 바탕으로 미래로의 도전을 시작한 두 사람이 함께하는 순간을 소중히 여기며 새로운 시작을 맞이하는 이야기
392,"이 곡은 두 사람이 협력하여 새로운 도전을 시작하고, 함께 성장하며, 무한한 가능성을 추구하는 과정을 통해 운명적인 연결을 느끼는 이야기를 전달합니다."
393,"일상의 소소한 즐거움과 우정을 나누는 가운데, 잠시 동안 잊었던 감정들을 다시금 느끼며 서서히 변화하는 계절을 받아들이는 이야기"
394,"이 곡은 꿈과 용기를 주제로 한 청춘의 이야기로, 미래에 대한 기대와 설렘, 그리고 자신의 진정한 목소리를 찾고자 하는 열망을 표현하고 있다."
395,밝고 희망찬 분위기 속에서 자신과 자신의 감정을 찾아가는 과정과 그로 인한 성장을 경험하는 이야기
396,"이 노래는 사랑과 용기를 잃어버렸던 과거를 뒤로하고, 이제는 함께 달리고 싶다는 바람을 노래하며, 희망과 구원의 메시지를 전달한다."
397,"이 곡은 꿈을 향해 도전하고 열정을 불태우며, 진정한 사랑과 우정을 추구하고, 현재를 온전히 살아가며 미래를 향해 전진하는 삶의 이야기를 담고 있다."
398,"이 곡은 두 여성의 우정과 경쟁, 그리고 성장을 다루며, 어려움 속에서도 서로를 지지하고 함께 꿈을 향해 나아가는 이야기를 노래한다."
399,이 곡은 자신과 자신의 감정을 이해하고 표현하는 데 어려움을 겪는 사람이 자신의 꿈을 찾고 사랑을 경험하며 성장하는 과정을 이야기한다.
400,이 곡은 주인공이 특별한 밤을 즐기며 자신의 욕망을 실현하고 자유로워지고자 하는 열망을 표현하고 있다.
401,이 곡은 꿈을 잃지 않고 자신과 친구들을 믿으며 앞으로 나아가자는 메시지를 전하는 희망찬 노래이다.
402,"희망을 찾아 끊임없이 도전하고 성장하는 과정을 통해 꿈과 미래를 향해 나아가는 이야기로, 전체적으로는 긍정적이고 역동적인 감정이 주를 이룬다."
403,"이 곡은 추운 겨울밤, 사랑하는 사람과 함께하는 따뜻한 순간들을 그리며, 그 관계가 지속되길 바라는 희망과 사랑을 노래한다."
404,이 곡은 희망과 용기를 잃어버린 상황에서 서로에게 손을 내밀며 진정한 행복을 찾아가는 과정을 노래한다.
405,멀어졌던 자신의 뿌리를 돌아보고 진정한 꿈을 찾아가는 과정에서의 설렘과 그리움을 표현한 곡이다.
406,이 노래는 꿈과 희망을 쫓으며 우정과 사랑을 통해 성장하고 발전하는 과정을 그린다.
407,"오래전 특별한 장소에서의 추억과 우정을 되살리며, 함께했던 순간들이 우연이 아니었음을 깨닫고 영원한 연결을 노래한다."
408,"이 곡은 꿈을 향해 달려가는 두 사람의 설렘과 희망, 그리고 함께하는 미래에 대한 기대와 사랑을 노래한다."
409,"이 곡은 꿈과 희망을 향해 달려가는 과정에서의 설렘과 행복, 그리고 그 꿈을 함께 이루고 싶은 사랑과 열망을 노래한다."
410,"이 곡은 주인공이 일상 속에서 춤추고자 하는 욕망과 꿈을 추구하는 과정에서 느끼는 자유와 행복, 그리고 그에 따른 설렘과 기대를 표현하고 있다."
411,밝고 희망찬 미래를 향해 두근거리는 설렘과 기대감으로 가득 찬 청춘의 이야기
412,"이 곡은 주인공이 진정한 자신을 숨기고 있던 과거를 돌아보고, 진정한 강함과 자신의 감정을 받아들이며 성장해가는 과정을 노래한다."
413,설렘과 행복이 가득한 파티에서 사랑과 우정을 나누며 함께하는 기쁨을 노래하는 곡이다.
414,이 곡은 여름 축제의 밤을 배경으로 두 사람이 함께 즐거운 시간을 보내는 동안 느끼는 설렘과 행복을 노래한다.
415,"이 곡은 자신감 부족과 외로움 속에서 누군가의 지지와 사랑을 통해 성장하고, 그 사랑과 지지가 가져다주는 감동과 열정을 노래한다."
416,외로움과 고독을 극복하고 자신과 타인을 이해하며 긍정적인 관계를 맺고자 하는 서정적 자아 성찰의 이야기
417,"이 곡은 시간의 흐름과 계절의 변화를 통해 청춘의 덧없음과 아름다움을 표현하며, 누군가를 그리워하고 함께하고 싶은 마음을 노래한다."
418,"이 곡은 누군가와의 추억을 소중히 여기며, 그 사람과 함께 성장해 나가고 싶은 마음과 언제나 함께하고 싶다는 그리움을 표현하고 있다."
419,이 곡은 꿈과 희망을 향해 도전하며 자신의 미래를 개척해 나가는 과정에서의 설렘과 각오를 노래한다.
420,이 곡은 인생의 순간들을 소중히 여기고 과거와 현재를 연결하며 미래에 대한 희망과 감사의 감정을 표현하고 있다.
421,이 곡은 과거의 소중한 추억을 떠올리며 미래를 향해 나아가는 희망과 감사의 마음을 표현하고 있다.
422,"이 곡은 과거의 설렘과 꿈을 추억하며, 현재의 불안과 도전을 극복하고 미래를 향해 나아가는 희망과 성장을 이야기한다."
423,"이 곡은 과거의 추억과 미래의 희망을 돌아보며, 친구들과의 소중한 만남과 일상의 행복을 노래하며, 그 속에서 느끼는 기쁨과 감사의 감정을 표현한다."
424,"불만족과 열망이 뒤섞인 채로, 자신의 한계를 뛰어넘어 꿈을 향해 끊임없이 도전하는 서사를 그리고 있다."
425,두려움과 호기심을 안고 미지의 세계를 향한 여정을 떠나는 사람들의 이야기
426,오래된 추억과 친구에 대한 그리움을 되살리며 미래를 향해 나아가는 한 개인의 이야기
427,"이 곡은 여름밤의 추억과 그리움을 노래하며, 잊고 싶은 감정들을 어떻게든 간직하고자 하는 마음을 표현한다."
428,이 곡은 자유와 우정을 추구하며 성장하는 청춘의 설렘과 이상을 표현하고 있다.
429,"밤하늘의 별빛과 함께 시작한 두 사람의 영원한 약속과 끊이지 않는 사랑의 이야기를 통해, 시간과 공간을 초월한 무한한 가능성과 희망을 추구하는 여정을 노래한다."
430,"이 곡은 서로의 감정을 공유하고 이해하며, 함께 새로운 길을 걸어가자는 약속과 그리움을 표현한다."
431,불확실한 미래에 대한 불안과 두려움을 극복하고 각자의 꿈과 이상을 실현하기 위해勇気を 내어 새로운 도전을 시작하는 과정을 그린 곡이다.
432,이 곡은 우울한 상황에서 벗어나 밝은 미래를 향해 나아가는 과정을 통해 희망과 끈끈한 유대감을 노래한다.
433,"이 곡은 희망과 설렘을 간직한 채 어려움을 극복하고 앞으로 나아가며, 함께 하는 사람들의 유대와 성장을 노래한다."
434,"이 곡은 멀리 있는 사람과 가까이 있는 사람, 모두와 연결되고 싶어 하는 열망과, 끊임없이 도전하며 앞으로 나아가고자 하는 의지를 표현하고 있다."
435,이 곡은 달콤한 음식을 참아내며 발렌타인 데이를 기다리는 설렘과 그날의 선물로 최고의 초콜릿을 받게 되면서 느끼는 행복과 감사의 감정을 노래한다.
436,새로운 시작을 두려워하지 않고 용기를 내어 미래를 향해 나아가는 여정을 노래하는 곡이다.
437,"이 노래는 어둠에 갇힌 주인공이 달빛과 사랑하는 이의 목소리에 이끌려 구원받으며, 영원한 사랑을 믿고 앞으로 나아가는 서사를 그리고 있다."
438,"이 곡은 과거의 추억과 현재의 감정을 통해 미래를 향한 희망과 사랑을 노래하며, 시간의 흐름과 함께하는 인간의 감정 변화를 섬세하게 표현하고 있다."
439,"청춘의 파티 타임에 대한 동경과 설렘, 그리고 영원한 사랑과 우정을 추구하는 이야기가 감정선으로貫されている."
440,"이 곡은 불확실한 미래에 대한 설렘과 기대, 그리고 새로운 도전을 향한 열망을 표현하며, 청춘의 순수함과 자유로움을 노래한다."
441,"이 곡은 사랑과 감사의 감정을 통해 삶의 동반자와의 깊은 관계를 되돌아보고, 그들에게 받은 사랑과 지지를 인정하며, 자신의 감사의 마음을 표현하고 상대방에게 전하고자 하는 내용을 담고 있다."
442,이 곡은 자신과 주변 사람들을 돌아보며 성장과 이해의 과정을 거쳐 상실과 작별을 받아들이고 희망을 노래한다.
443,"이 곡은 힘든 상황에서 벗어나 밝은 미래를 맞이하자는 희망과 격려의 메시지를 전하며, 도전과 성장을 통해 진정한 자신을 찾고 행복해지자는 이야기를 한다."
444,"새로운 시작과 성장을 향한 열망과 희망을 안고, 함께 걸어가며 서로의 사랑과 꿈을 나누는 이야기이다."
445,"이 곡은 과거의 두려움과 자신을 가린 현실을 극복하고, 소중한 사람과 함께 꿈을 향해 달려가는 성장과 희망의 이야기로, 자유와 열정을 핵심 감정으로 한다."
446,"이 곡은 불확실한 미래와 현재의 소중함에 대해 노래하며, 사랑과 삶의 의미를 찾아가는 여정을 통해 위안과 희망을 주는 서사를 가지고 있다."
447,"이 곡은 꿈과 희망을 향해 달려가는 과정에서의 설렘과 열망, 그리고 그 꿈을 이루기 위한 노력과 자신감을 표현하고 있다."
448,"설렘과 행복이 가득한 두 사람의 데이트와 사랑을 노래하며, 미래의 약속과 추억을 쌓아가는 과정을 표현하고 있다."
449,"이 곡은 꿈과 현실을 오가며 진정한 감정을 찾고, 이를 표현하기 위해 노력하는 내적 여정을 노래한다."
450,"이 곡은 힘든 상황에서 벗어나기 위해 스스로를 독려하고, 곁에 있는 누군가에게 용기를 북돋아주며, 결국에는 그 어려움을 함께 극복하고 더 강해지자는 희망찬 메시지를 전한다."
451,"이 곡은 꿈과 사랑을 좇는 과정에서 겪는 다양한 감정을 통해, 끊임없이 전진하며 자신의 감정을 표현하고 타인과의 연결을 추구하는 서사를 그리고 있다."
452,자유와 성장을 추구하며 어려움을 극복하고 새로운 가능성을 향해 나아가는 과정에서의 설렘과 희망을 노래한다.
453,꿈과 현실 사이에서 방황하며 사랑과 자유를 추구하는 젊은이들의 이야기가 감정과 모험으로 가득한 여정으로 펼쳐진다.
454,이 곡은 자유와 행복을 추구하며 두려움을 극복하고 꿈과 감정을 표현하는 서사를 그리고 있다.
455,복잡한 감정 속에서 자신과 상대방의 감정을 조절하며 사랑에 대한 진정한 감정을 표현하지 못하는 두 사람의 마음을 그린 곡
456,과거의 기억과 감정을 되살려 사랑하는 사람과 함께 걸으며 잃어버린 감정과 추억을 되찾는 이야기
457,자신감 부족과 소극적인 태도에서 벗어나 성장하고 싶은 열망과 용기를 내어 새로운 도전을 하고자 하는 이야기를 담은 곡이다.
458,"이 곡은 꿈과 희망을 잃지 않고 앞으로 나아가고자 하는 메시지를 전달하며, 청춘의 열정과 순수함을 노래한다."
459,이 곡은 스스로에게 한계를 설정하고 두려워하는 마음을 극복하여 자신의 가능성을 넓히고 꿈을 향해 도전하자는 메시지를 전달하는 노래이다.
460,이 곡은 주인공이 엔젤 전기 댄서를 만나 함께 꿈과 비밀을 공유하며 행복을 찾아가는 과정을 노래한다.
461,"이 곡은 꿈과 사랑, 연결의 중요성을 통해 희망과 긍정적인 메시지를 전달하며, 함께 걸어가는 삶의 아름다움을 노래한다."
462,"이 곡은 두 여성의 우정과 경쟁을 통해 성장하고, 서로를 지지하며 꿈을 향해 나아가는 이야기를 감동과 설렘으로 표현하고 있다."
463,이 곡은 사랑과 중독의 감정을 통해 상실과 고독을 극복하려는 서사를 그리고 있다.
464,"이 노래는 인생이라는 이야기를 페이지 넘기듯 담담하게 살아가면서도, 때로는 고통스럽고 어려운 상황을 맞이하며 결국에는 그 모든 것이 하나의 이야기로 귀결되는 과정을 표현한다."
465,"이 곡은 사랑하는 사람과의 이별과 그리움을 통해 삶의 의미와 과거의 추억을 되돌아보며, 다시 한번 사랑했던 사람의 목소리와 웃음을 듣고 싶어 하는 마음을 표현하고 있다."
466,"이 곡은 지나간 시간과 현재의 자신, 그리고 미래에 대한 불안과 희망을 그리며, 잃어버린 것과 소중한 것을 찾는 여정을 통해 성장과 자기 발견의 서사를 전달합니다."
467,설렘과 즐거움을 느끼며 인생을 즐겁게 시작하고 싶어 하는 한 사람의 욕망과 그 속에서 느끼는 행복에 대한 이야기
468,"청춘기의 설렘과 불안, 그리고 그 순간의 아름다움을 추억하는 서정적인 이야기"
469,이 곡은 불안과 두려움을 극복하고 자신의 꿈과 희망을 이루어가는 강한 의지와 긍정적인 메시지를 전달한다.
470,"이 곡은 불완전한 관계와 감정의 혼란을 경험하는 사람의 심정을 표현하며, 상실감과 애틀이한 감정 속에서 방황하는 서사를 담고 있다."
471,"힘겨운 현실을 함께 극복하고 사랑을 찾아가며, 서로를 지지하고 이해하는 두 사람의 이야기"
472,이 곡은 자신과 다른 이의 감정과 마음을 제대로 파악하지 못해 상실감과 불안감을 느끼는 서운한 이별의 감정을 노래한다.
473,이 곡은 누군가를 잃은 후에도 그 사람과 함께했던 추억들이 생생하게 떠올라 괴로워하는 내적 갈등과 그리움을 표현한다.
474,사랑과 상실의 아픔을 극복하고 마침내 행복한 순간을 맞이하게 되는 과정을 노래한 곡이다.
475,"이 곡은 사랑과 그리움, 그리고 꿈에 대한 열망을 표현하며, 인생의 복잡함과 사랑의 어려움을 겪는 감정을 섬세하게 전달한다."
476,"이 곡은 꿈을 향해 달려가는 과정에서의 고난과 좌절, 그리고 끝내 자신의 한계를 극복하고 미래를 향해 나아가려는 의지와 희망을 이야기한다."
477,"이 곡은 사랑과 자유에 대한 열망을 표현하며, 금지된 사랑과 사회적 기대에 대한 좌절감을 담고 있다."
478,"설렘과 긴장 속에 두근거리는 마음을 간직한 채, 좋아하는 사람과 조금씩 다가서며 비밀스러운 관계를 즐기는 서정적인 이야기를 담고 있다."
479,"이 곡은 누군가를 향한 사랑과 그리움을 표현하며, 그 사람과의 관계에서 느끼는 감정의 복잡성과 상실감을 이야기한다."
480,"이 노래는 밤하늘의 별빛을 보며 과거의 추억과 소망을 떠올리고, 그 감정을 간직한 채로 앞으로 나아가며 언젠가 누군가의 마음에 우리의 생각이 빛처럼 지속될 것이라는 희망과 감동을 표현한다."
481,"이 노래는 불확실한 미래에 대한 불안과 두려움을 느끼지만, 희망과 꿈을 포기하지 않고 앞으로 나아가려는 의지와 열망을 표현하고 있다."
482,어둠과 악을 물리치고 정의를 구현하려는 전사들의 열정과 헌신이 담긴 투쟁이 빛나는 희망으로 물들어간다.
483,"이 노래는 사랑과 상실의 고통을 통해 시간과 기억이 흐르는 과정, 그리고 잊을 수 없는 감정을 표현한다."
484,이 곡은 꿈과 자아를 잃지 않기 위해 노력하며 새로운 도전을 향해 나아가는 서사를 통해 희망과 성취의 감정을 표현한다.
485,"이 곡은 사랑과 열정을 표현하며, 상대방을 향한 애타는 감정과 사랑을 주고받는 로맨틱한 순간들을 노래한다."
486,"이 곡은 자아 발견과 욕망, 사랑과 괴로움의 복잡한 감정을 탐구하며, 어둡고 중독성 있는 욕망에 빠져드는 젊은 여성의 내면을 표현한다."
