idx,desc
487,"이 곡은 불완전한 세계에서 자신의 정체성과 삶의 의미를 찾아가는 과정에서의 불안과 좌절, 그리고 희망과 긍정적인 메시지를 전달한다."
488,절망적인 상황에서 벗어나 희망을 찾아가는 과정에서의 내적 갈등과 성장을 경험하는 이야기
489,이 곡은 과거의 후회와 현재의 다짐을 통해 앞으로 나아가는 성장과 희망의 이야기를 전한다.
490,"이 곡은 도전과 승리, 그리고 끊임없는 노력의 중요성을 강조하며, 자신의 꿈과 목표를 위해 전심으로 싸워야 한다는 메시지를 전달한다."
491,"이 곡은 열정과 도전의 감정을 담고 있으며, 자신의 꿈과 목표를 향해 전진하는 과정에서 느끼는 강렬한 에너지와 자신감을 표현하고 있다."
492,이 곡은 삶의 어려움과 도전을 직면하면서도 절대 포기하지 말고 자신을 믿고 앞으로 나아가는 강한 의지와 결심을 담고 있다.
493,"이 곡은 내면의 허무함과 불안을 극복하고자 하는 열망과 좌절, 그리고 진정한 아름다움과 만족을 갈구하고 탐구하는 서사를 그리고 있다."
494,"이 곡은 자신을 희생해서라도 자신의 가치를 주장하고 싶어 하는 화자의 내면의 갈등과 좌절, 그리고 용서를 구하는 심정을 표현하고 있다."
495,"이 곡은 사랑하는 사람과 함께한 과거의 행복한 순간들을 그리며, 사랑의 상실과 그리움에 따른 고통을 표현하고 있다."
496,상처받은 자신을 감추고 거짓된 삶을 이어가던 주인공이 진정한 자신의 감정을 깨닫고 앞으로 나아가려는 내적 갈등과 성장을 표현한다.
497,"이 곡은 불안과 절망 속에 살면서도, 자신의 삶을 긍정적으로 변화시키고 싶어 하는 내면의 갈등과 도전을 표현한다."
498,"이 곡은 자신감과 긍정적인 에너지를 바탕으로 인생을 즐기고, 모든 사람을 행복하게 하며, 세상을 자신의 것으로 만들겠다는 의지와 꿈을 표현하고 있다."
499,"모두가 하나가 되어 서로를 위해 노력하지만, 한편으로는 강한 경쟁과 분노를 느끼며, 결국에는 각자의 가치를 인정하고 하나가 되는 과정을 겪는 이야기"
500,"이 곡은 가면 뒤에 숨겨진 진정한 자아를 드러내며, 사회의 불만과 불평을 토로하고, 자유로운 표현을 촉구하는 서사를 그리고 있다."
501,"이 노래는 개인의 욕망과 열망이 뒤엉킨 혼돈 속에서 자아를 잃지 않고 자신의 정체성을 찾아가며, 끊임없이 도전하고 성장하는 과정을 표현한다."
502,"젊은이가 인생을 즐기며 성장해 나가고자 하는 욕망과 자유로운 삶을 추구하는 가운데, 자신을 둘러싼 기대와 비판에 대처하며 살아가는 과정을 그린다."
503,절망과 억압에서 벗어나기 위해 내면의 힘과 자신감을 발휘하여 어려움을 극복하고 성장하는 과정
504,"이 곡은 삶의 모든 순간을 사랑과 열정으로 가득 채우고, 그 감정을 노래를 통해 표현하며, 끝없이 전진하는 삶의 의지와 긍정적인 메시지를 전달한다."
505,이 곡은 험난한 세상 속에서 삶의 어려움을 온몸으로 받아들이며 끝까지 자신의 길을 걸어가는 한 개인의 내적 갈등과 절실한 의지를 표현하고 있다.
506,어둡고 불안한 상황에서 벗어나기 위해 스스로를 희생하고 운명을 받아들이는 과정에서의 갈등과 고뇌를 표현한 곡이다.
507,"이 노래는 불확실한 미래에 대한 불안과 절망, 그리고 그것을 극복하고 성장해 나가려는 의지와 희망을 표현하고 있다."
508,자신의 신념을 잃지 않고 끝까지 포기하지 않는 삶을 살아가는 것에 대한 이야기
509,"자신감과 반항심으로 가득 찬 젊은이들이 현 상태에 도전하며 앞으로 나아가고, 비판에 굴하지 않고 자신의 길을 걸으며 성공을 향해 달려간다."
510,"이 곡은 내면의 충동과 갈등을 극복하고, 자신의 길을 찾아가는 과정에서의 고뇌와 다짐을 표현한다."
511,"이 곡은 자아 발견과 자기 표현의 여정을 통해 내면의 혼란과 열망을 극복하고, 진정한 자신을 찾아가는 과정을 그리며 희망과 자신감을 노래한다."
512,격렬한 열정과 반항 정신을 앞세워 일상의 부정적인 감정을 극복하고 해방감을 느끼는 과정
513,"이 곡은 현실 세계의 제약과 고통을 극복하고 이상적인 삶을 추구하는 과정에서 느끼는 갈등과 도전을 표현하며, 궁극적으로는 자유와 성취를 향한 열망을 노래한다."
514,"이 곡은 삶의 순간들을 함께하며, 서로를 지지하고 사랑을 나누는 것의 중요성을 노래하며, 불확실한 미래에도 불구하고 현재를 즐기고 서로를 지지하며 살아가는 메시지를 전달한다."
515,"자신에 대한 끊임없는 자각과 반추를 통해 내면의 혼란과 갈등을 겪지만, 결국 자신의 아이덴티티를 찾고 앞으로 나아가는 과정에 대한 이야기"
516,이 곡은 자아 발견과 자기 수용의 과정을 통해 내적 갈등을 극복하고 앞으로 나아가려는 의지와 희망을 표현하고 있다.
517,밝고 신나는 꿈과 행복에 대한 이야기가 담긴 가사가 전반적으로 기쁨과 설렘을 표현하고 있다.
518,누군가의 수고와 노력을 위로하고 공감하는 마음을 담은 곡
519,이 곡은 새로운 도전을 두려워하지 않고 친구들과 함께 손을 잡고 앞으로 나아가며 행복과 웃음을 전파하는 메시지를 전한다.
520,꿈과 희망을 좇는 젊은이의 열망과 도전을 통해 성장하고 싶은 욕망이 담긴 곡이다.
521,"이 곡은 자신과 타인과의 관계에서 생기는 감정의 혼란과 그리움을 아름답게 표현하며, 결국에는 모든 감정을 긍정적으로 포용하고 화합하는 서사를 그리고 있다."
522,"이 곡은 누군가의 지친 일상과 그에 따른 감정을 위로하고, 희망과 아름다움이 가득한 미래를 꿈꾸게 하는 서사를 그리고 있다."
523,이 곡은 힘들고 어려운 상황에서도 희망을 잃지 않고 친구들과 함께 웃으며 미래를 향해 나아가자는 메시지를 전달한다.
524,"이 곡은 자신감과 설렘을 바탕으로 하여 새로운 경험에 도전하고 즐기는 과정을 서술하며, 그 속에서 느껴지는 자유와 해방감을 표현하고 있다."
526,"자신의 삶을 긍정적으로 살고자 하는 의지와 자기성찰, 그리고 일상의 탈출에 대한 열망이 담긴 곡이다."
527,이 곡은 마지막으로 최고의 에너지를 발휘하여 승리를 쟁취하려는 열망과 결의에 찬 메시지를 전한다.
528,절망과 고통 속에서 예술과 저항의 목소리를 내며 세상을 변화시키고자 하는 열망과 의지로 가득 찬 이들의 이야기는 희망찬 새 세상을 향한 외침으로 울려 퍼진다.
529,"한 소녀가 자신의 진정한 모습을 찾고, 세상을 향해 용기 내어 나아가는 이야기이다."
530,"이 곡은 사랑과 상실, 자아 발견의 과정을 통해 내면의 갈등과 감정의 혼란을 경험하며, 자신의 정체성과 존재에 대해 탐색하는 서사를 그리고 있다."
531,"이 곡은 자신감과 열망을 키워드로 하여, 과거의 만남이 가져온 변화와 현재의 도전을 극복하려는 의지를 표현하고 있다."
532,"이 곡은 자신의 존재와 정체성에 대한 불안과 고민, 그리고 그에 대한 깨달음과 새로운 시작에 대한 열망을 노래한다."
533,"이 곡은 자유와 해방을 추구하며, 최고의 자신으로 거듭나고자 하는 욕망과 자신감에 대한 이야기로, 기쁨과 자신감의 감정이 교차하는 서사를 담고 있다."
534,"복잡한 감정과 관계 속에서 우정과 추억을 쌓아가며, 두려움 없이 자유롭게 자신의 길을 걸어가는 것에 대한 이야기"
535,"이 노래는 자기 자신을 극복하고 성장해 나가는 과정에서의 각오와 의지를 표현하며, 한계와 어려움을 극복하고 무한한 가능성을 실현해 나가는 서사를 그리고 있다."
536,"차갑고 냉랭한 세계에서 벗어나 밝은 미래를 향해 나아가고자 하는 열망과 좌절, 그리고 궁극적으로는 희망과 저항의 메시지를 담은 감동적인 이야기이다."
537,"이 곡은 꿈과 열망을 불태우며, 끊임없이 도전하고 앞으로 나아가는 것의 중요성을 노래한다."
538,"분노와 좌절, 무력감을 느끼는 젊은이가 자신의 감정을 표현하고 변화의 필요성을 주장하며 앞으로 나아가는 과정"
539,이 곡은 상실과 그리움에 괴로워하는 화자가 사랑하는 사람에게 자신의 마음을 전달하고 관계를 맺고자 하는 절실한 감정을 표현하고 있다.
540,"절망과 허무에 저항하는 내면의 분노와 좌절, 그럼에도 불구하고 희망을 잃지 않으려는 인간의 내적 갈등과 모순을 표현한 곡이다."
541,"자신들의 음악적 열정과 야망을 불태우며, 고난과 충돌을 겪더라도 끝없이 도전하고 성취하려는 젊은이들의 이야기"
542,"이 곡은 어둠을 헤쳐나가며 앞으로 나아가는 주인공이 느끼는 강한 의지와 혼돈, 자유에 대한 욕구를 그리며, 진정한 빛과 자신을 발견하는 여정을 통해 내면의 평화와 용기를 얻는 서사를 그리고 있다."
543,"이 곡은 끊임없는 도전과 성장을 추구하며, 자신감과 열정으로 가득 찬 삶의 서사를 그리고 있다."
544,"이 곡은 잃어가는 것보다 얻는 것이 더 많다는 믿음을 바탕으로, 희망과 빛을 잃지 않고 계속 나아가며, 함께 어려움을 극복하고 평안을 찾는 메시지를 전달한다."
545,이 노래는 사랑과 동반자 관계를 통해 어려움을 극복하고 영원히 함께하고자 하는 간절한 바람을 표현하고 있다.
546,"자신과 타인의 가치를 인정하고 함께 성장하며, 인생의 진정한 의미를 찾고자 하는 내적 여정을 통해 희망과 자신감을 얻는 이야기"
547,일상적인 부조리와 맞서며 자신의 정체성과 가치를 잃지 않으려는 의지와 자기 확립을 추구하는 과정을 통해 자아를 찾아가는 이야기
548,"이 곡은 인생의 어려움을 극복하고 행복을 추구하며, 자신의 운명을 긍정적으로 받아들이는 메시지를 전한다."
549,이 곡은 사랑하는 사람에게 자신의 감정을 전달하지 못해 허전함과 그리움을 느끼는 서정적인 내용을 담고 있다.
550,"이 곡은 사랑과 상실, 그리고 내면의 혼란을 겪는 한 사람의 심정을 통해, 진정한 사랑과 자아를 찾아가는 과정을 표현하고 있다."
551,"이 곡은 상실과 그리움을 통해 과거의 추억과 감정을 되돌아보고, 미래를 준비하는 과정을 노래한다."
552,"이 노래는 시간과 공간을 초월하여 살아남은 존재들이 겪는 혼돈과 자유에 대한 이야기로, 모험과 해방감을 표현하고 있다."
553,"이 곡은 자아 확립과 우월감에 대한 메시지를 전달하며, 자신감과 허무함이 교차하는 감정을 표현한다."
554,"불완전한 자신을 받아들이고 성장해 나가는 과정에서의 설렘과 두려움을 표현하며, 타인과 함께하며 느끼는 감동과 일체감을 추구하는 서사를 그리고 있다."
555,"이 곡은 어둡고 어려운 상황 속에서도 사랑하는 사람에게 헌신하고 싶은 마음을 표현하며, 그로 인한 내적 갈등과 도전을 그린다."
556,"이 노래는 두려움과 불안 속에서도 누군가를 위해 살아가고자 하는 의지와 사랑의 중요성을 그리며, 고난과 외로움 속에서의 자기 극복과 성장을 그린다."
557,이 노래는 누군가에 대한 사랑과 증오의 감정이 충돌하며 비밀을 간직하려는 노력과 그로 인한 고통을 표현하고 있다.
558,이 곡은 외로움과 두려움을 극복하고 자신의 꿈을 이루기 위해 끊임없이 노력하는 개인의 여정을 그리고 있다.
559,"이 곡은 성장의 고통과 자유에 대한 열망을 노래하며, 주인공이 성인이 되기 위해 과거의 즐거움을 버리고 앞으로 나아가는 과정을 그린다."
560,"이 노래는 사랑하는 사람과 떨어져 있는 상황에서 느끼는 그리움과 고독, 그리고 그 사람에 대한 끊임없는 사랑을 표현한다."
561,"욕망과 허무함에 괴로워하는 젊은이들의 불안과 좌절, 그리고 그것을 극복하려는 몸부림을 통해 자아를 찾고 싶은 욕망이 충돌하는 내적 갈등을 표현한다."
562,"이 곡은 사랑과 증오의 감정이 뒤섞인 복잡한 감정 상태를 표현하며, 비밀과 거짓말, 그리고 궁극적인 고백과 상실을 통해 사랑과 증오의 얽힘을 서사적으로 전달한다."
563,절망과 허무의 순간을 겪으며 자신과 세상의 본능적인 면을 받아들이는 과정을 노래한다.
564,"이 곡은 모방과 우월감에 대한 이야기로, 화자는 자신과 타인의 유사성을 조롱하며, 타인의 우월감과 자신에 대한 멸시를 표현하면서도 동시에 질투와 동경을 느낀다."
565,절망과 허무주의 속에서 사랑과 연결을 갈망하는 서정적 자아의 모습이 담긴 곡이다.
566,"절망과 고통 속에서도 희망을 잃지 않고, 기억과 감정을 되살리기 위해 노력하는 내적 갈등과 성장의 이야기"
567,"이 곡은 사랑과 그리움, 그리고 성장의 고통과 아름다움을 통해 영원한 청춘의 순간을 그리워하며, 과거를 반복하지 않고 앞으로 나아가고자 하는 메시지를 전한다."
568,이 곡은 사랑하는 사람과 함께하고 싶어 하는 마음과 그 안에 담긴 다양한 감정들을 노래한다.
569,"불우한 환경과 사회적 압박 속에서도 자신의 이상과 자존심을 잃지 않으려는 청춘의 모습이 담긴, 투쟁과 고뇌의 이야기"
570,곡은 어둠과 고독감을 느끼며도 희망과 결심을 가지고 앞으로 나아가는 내용을 담고 있다.
571,어둠과 불안이 가득한 세상을 자신만의 색으로 채우고자 하는 의지와 결심이 담긴 노래이다.
572,두 사람이 함께 앞으로 나아가며 서로의 약점을 보완하고 강함을 발휘하여 어려움을 극복하고 밝은 미래를 만들어가는 과정을 표현한다.
573,"이 곡은 어려운 상황에서 희망과 안식을 주는 존재에 대한 감사와 사랑을 표현하며, 삶의 어둡고 어려운 순간들을 극복하고 행복과 변화로 이끄는 메시지를 전달한다."
574,"이 곡은 고뇌와 좌절, 그리고 궁극적으로는 희망과 일체감을 향한 인간의 내적 여정을 그리며, 개인과 세계를 연결하는 감정의 본질을 탐구한다."
575,이 곡은 내적 고통과 고난을 겪으면서도 희망과 믿음을 잃지 않고 앞으로 나아가려는 의지와 그로 인한 내적 성장을 표현한다.
576,이 곡은 불확실함과 두려움 속에서도 자신의 가능성을 믿고 끊임없이 도전하며 성장해 나가는 서사를 노래한다.
577,이 곡은 어려움에 직면했을 때 내면의 힘과 친구들과의 유대감을 통해 희망을 찾고 미래를 향해 나아가는 메시지를 전달한다.
578,이 곡은 내적 갈등과 고통을 겪으며 스스로를 잃지 않고 스스로 일어서겠다는 다짐과 희망을 표현하고 있다.
579,"이 곡은 희망과 연결의 중요성을 강조하며, 개인의 성장과 도전을 통해 더욱 강한 유대감을 형성해 나가는 서사를 그리고 있다."
580,"이 곡은 인생의 만남과 이별, 그리고 영원한 연결에 대한 이야기로, 끊임없는 삶의 흐름 속에서 느끼는 기쁨과 슬픔, 그리움과 감사함을 담고 있다."
581,"이 곡은 과거의 상처와 약함을 극복하고 성장하여 앞으로 나아가며, 서로의 존재가 서로에게 큰 의미임을 깨닫는 과정을 노래한다."
582,"이 곡은 어려움과 도전 속에서도 자신의 의지를 잃지 않고 앞으로 나아가며, 영원히 지속되는 감정과 연결된 여정을 노래한다."
583,"이 곡은 자기 자신을 사랑하고 받아들이며, 어려움을 극복하고 성장하여 자신의 가치를 인정하고 다른 사람에게 긍정적인 영향을 미치는 과정을 노래한다."
584,"이 곡은 불확실하고 힘겨운 상황에서도 포기하지 않고 꿈을 향해 나아가며, 언젠가 빛나는 미래를 맞이할 것이라는 희망과 의지를 표현하고 있다."
585,"이 노래는 이상과 현실 사이에서 갈등하며 꿈을 추구하고, 어려움을 극복하고, 진정한 자신을 찾아가며 형성되는 소중한 인연과 사랑의 감정을 표현한다."
586,"이 곡은 고통과 슬픔을 극복하고 희망과 감사의 메시지를 전달하며, 끊임없는 도전과 성장을 통해 영원히 전진하는 삶의 서사를 표현한다."
587,절망과 희망 속에서 자신의 정체성과 신념을 찾아가며 성장하는 과정을 그린다.
589,"이 곡은 불확실한 미래에도 불구하고 자신의 위치를 찾고, 소중한 사람과 함께 걸으며, 행복과 사랑을 간직하려는 의지와 다짐을 표현하고 있다."
590,"이 곡은 개인의 성장과 도전을 통해 자신의 미래를 만들어가며, 어려움을 극복하고 목표를 향해 나아가는 과정을 노래한다."
591,"불확실한 세계에서 자신의 존재를 희생하여 일어서고, 과거를 돌아보지 않고 앞으로 나아가며 영원히 살고자 하는 의지와 감사를 표현하는 곡이다."
592,"이 곡은 빛과 어둠의 상호작용을 통해 태어난 존재들이 자신의 운명을 깨닫고 실현시키며, 영원한 연결과 구원을 향한 여정을 노래한다."
593,"이 노래는 선택과 운명, 그리고 함께하는 사람들 속에서 느끼는 감정과 성장에 대해 이야기하며, 결국에는 포기하지 않고 싸워나가며 서로를 지지하고 사랑하는 것이 중요하다는 것을 표현하고 있다."
594,"이 노래는 불확실한 미래와 어려움 속에서도 자신의 신념을 잃지 않고 성장하며, 타인과의 진정한 연결을 통해 위로와 용기를 얻는 과정을 그린다."
595,"이 곡은 자기 자신의 내면과 직관에 귀 기울이며, 스스로가 답을 찾고 진정한 자신을 추구하는 과정을 통해 희망과 긍정적인 미래를 모색하는 여정을 노래한다."
596,"이 곡은 어려운 현실에 직면하여도 포기하지 않고 앞으로 나아가며, 희망을 잃지 않고 자신의 미래를 위해 노력하는 삶의 이야기를 그리고 있다."
597,"이 곡은 다섯 명의 주인공이 서로를 지지하고 사랑하며, 끊임없이 변화하는 세상에서도 함께 노래하며 자신들의 감정과 추억을 소중히 여기는 내용을 담고 있다."
598,"이 곡은 과거를 정리하고 미래를 향해 나아가는 과정에서의 불안과 희망, 그리고 성장과 변화를 통해 궁극적으로 행복과 영광을 추구하는 여정을 노래한다."
599,이 곡은 불확실한 미래와 내적 갈등을 겪는 와중에도 희망을 잃지 않고 사랑과 구원을 향한 갈망을 표현하고 있다.
600,"이 곡은 새로운 도전을 향한 준비와 각오, 그리고 끊임없는 노력과 도전을 통해 성장하고 성공에 도달하는 과정을 노래한다."
601,"이 곡은 고난과 좌절을 극복하고 자신의 꿈과 이상을 향해 끊임없이 도전하며, 희망과 용기를 잃지 않는 삶의 의지와 열정을 표현하고 있다."
602,"이 노래는 어둠과 고통에 둘러싸인 세계에서 자신의 정체성과 존재 이유를 찾아가는 과정에서의 불안과 저항, 그리고 궁극적으로는 자기 극복과 희망을 모색하는 여정을 그리고 있다."
603,"이 노래는 어린 시절의 순수함과 희망을 그리며, 시간의 흐름과 변화에도 불구하고 잊지 못하는 추억과 우정의 중요성을 노래한다."
604,"이 노래는 희망과 불안, 사랑과 용기를 통해 자신의 감정을 표현하고, 삶의 어려움을 극복하며 진정한 연결을 추구하는 여정을 그린다."
605,"이 곡은 내적 갈등과 고통스러운 성장에 관한 이야기로, 괴로움과 절망, 그리고 저항과 자기 수락의 감정이 뒤얽힌다."
606,"이 곡은 밝고 희망찬 분위기 속에서 개인의 성장과 빛나는 미래에 대한 동경, 그리고 타인과의 연결과 사랑을 통해 운명을 긍정적으로 받아들이는 서사를 그리고 있다."
607,"이 곡은 어려운 상황을 극복하고 서로를 지지하며 살아가는 데 필요한 용기와 사랑, 감사, 그리고 행복에 대해 이야기한다."
608,"이 곡은 과거를 단절하고 자신감과 확신을 가지고 미래를 향해 나아가며, 끊임없는 도전과 성장을 통해 최고의 자신을 실현하고자 하는 의지와 각오를 표현하고 있다."
609,"이 곡은 두려움을 극복하고 끊임없이 도전하며, 결국에는 빛나는 미래를 향해 나아가는 여정을 통해 형성되는 불멸의 유대와 희망을 노래한다."
610,"이 곡은 도전과 성장을 거듭하며 자신만의 길을 개척해 나가는 과정에서의 자신감과 의지를 표현하며, 과거의 경험을 토대로 미래를 향해 나아가는 내적 성장과 각오를 이야기한다."
611,"이 곡은 새로운 시작과 도전을 향한 열망과 결의에 찬 목소리를 통해, 두려움을 극복하고 승리를 향해 나아가는 과정에서의 감정과 성장을 그린다."
612,"이 곡은 자신에게 주어진 모든 경험과 감정을 긍정적으로 수용하고, 자신의 가치를 인정하며, 앞으로도 계속 성장하고 도전해 나갈 수 있는 용기와 희망을 주는 서사를 담고 있다."
613,"불확실한 미래에 직면했지만, 자신감과 열정을 가지고 도전과 성장을 거듭하며 꿈과 희망을 향해 나아가는 여정을 노래한다."
614,"이 노래는 도전과 경쟁을 통해 성장하고, 서로의 열정과 자부심을 공유하며 어려움을 극복해 나가는 과정을 그리고 있다."
615,"이 노래는 인간 존재의 의미와 운명에 대해 탐색하며, 절망과 희망을 오가는 감정을 통해 결국에는 모든 것이 소중하며, 운명을 긍정하는 메시지를 전한다."
616,"이 노래는 과거의 경험을 돌아보고 현재의 감정을 표현하며, 미래에 대한 희망과 다짐을 담고 있다."
617,"이 곡은 삶의 소중함과 아름다움을 노래하며, 행복과 사랑을 공유하고 영원히 함께하고 싶은 마음을 표현한다."
618,"이 노래는 사랑과 동반에 대한 따뜻한 감정을 표현하며, 서로를 지지하고 미래를 향해 나아가는 두 사람의 이야기를 전달한다."
619,"이 곡은 사랑과 희망을 노래하며, 삶의 중요한 순간들을 함께 나누고 미래를 향해 나아가는 여정을 이야기한다."
620,이 곡은 과거의 소중한 순간을 떠올리며 현재의 어려움 속에서도 희망과 감사를 잃지 않고 앞으로 나아가는 이야기를 노래한다.
621,"이 노래는 불굴의 의지와 긍정적인 에너지로 가득 찬 미래를 향해 나아가는 여정을 통해 자기 자신을 찾고, 성장하며, 타인과 함께 하는 소중함을 표현하고 있다."
622,이 곡은 인생의 순간들을 소중히 여기며 진정한 신념과 자신을 믿고 앞으로 나아가며 어려움을 극복하는 과정을 노래한다.
623,"이 곡은 개인의 성장과 도전을 통해 자신의 운명을 개척해 나가며, 끊임없는 도전과 자기 극복을 통해 이상을 실현하려는 의지와 감정을 표현하고 있다."
624,"이 곡은 꿈과 희망을 향한 도전을 노래하며, 절망과 고난을 극복하고 자유와 감정을 표현하는 여정을 통해 듣는 이에게 영감을 주는 곡이다."
625,"이 곡은 혼자가 아닌 함께하는 삶을 강조하며, 불평등과 어려움 속에서도 서로를 지지하고 자유롭게 자신의 길을 찾도록 격려하는 메시지를 전달한다."
626,이 곡은 자아 발견과 성장의 과정을 통해 자신의 운명을 받아들이고 미래를 향해 나아가는 여정을 노래한다.
627,"이 곡은 꿈과 희망을 잃지 않고 앞으로 나아가는 이들의 여정을 통해, 함께 하는 것의 중요성과 미래에 대한 긍정적인 전망을 표현한다."
628,"이 곡은 과거의 꿈과 어려움을 돌아보고 현재의 성장과 미래의 희망을 이야기하며, 자신과 타인과의 연결을 통해 앞으로 나아가는 메시지를 전한다."
629,"이 노래는 두 세력 간의 치열한 경쟁과 자신들 음악에 대한 자신감을 표현하며, 각자의 한계를 넘어서고 운명을 걸고 싸워서 마지막까지 승리를 쟁취하자는 의지와 열정을 나타낸다."
630,이 곡은 개인의 내적 성장과 희망을 향한 여정을 통해 굴하지 않는 결심과 빛나는 미래에 대한 꿈을 추구하는 메시지를 전달한다.
631,"순수한 꿈과 열망을 쫓던 삶에서 자아 발견과 성숙을 거쳐, 진정한 자아와 삶의 의미를 찾아가는 과정"
