idx,desc
0,절대적인 우정을 바탕으로 과거의 아픔을 극복하고 앞으로 나아가며 꿈을 향해 도전하는 내용의 노래이다.
1,"이 곡은 현실에 대한 불만과 불편함을 느끼지만, 그 속에서 자신을 찾고 앞으로 나아가며 새로운 것을 시작하는 희망과 자유를 노래한다."
2,"이 곡은 자신의 감정을 마구 표현하며, 과거의 상처를 극복하고 앞으로 나아가는 강한 의지와 자신감을 나타낸다."
3,"이 세계는 언제나 소중한 추억을 주며, 함께 있는 시간은 언제나 짧고 행복한 순간이 되고, 그 순간은 가장幸せ한 감정을 느끼게 한다."
4,삶의 변화를 받아들이고 서로의 마음을 믿으며 함께 앞으로 나아가는 과정에서 느끼는 감정과 상황이 담겨 있다.
5,"이 노래는 긴장감과 미스터리한 상황을 담고 있으며, 게임이나 모험과 같은 상황에서 느끼는 흥분과 불안을 표현하고 있다."
6,"이 곡은 삶의 도전과 사랑을 향한 열망을 담고 있으며, 자신을 믿고 앞으로 나아가는 과정에서 느끼는 감정을 표현하고 있다."
7,"이 곡은 사랑과 우정을 통해 자신을 찾고, 변하지 않는 관계를 소중히 여기는 감정을 담고 있다."
8,이 곡은 도전과 성장의 과정을 통해 자신을 증명하고 앞으로 나아가는 의지와 결심을 담고 있다.
9,힘든 상황에서도 서로를 믿고 앞으로 나아가며 꿈을 향해 열심히 노력하는 과정에서 느끼는 감정과 상황을 표현한다.
10,삶의 방향을 찾으며 자신을 믿고 앞으로 나아가는 과정에서 느끼는 희망과 자신감이 가득하다.
11,어려움과 고통이 있는 세계에서 친구들과 함께할 때만 진정한 안락과 평화를 느낄 수 있다.
12,"이 곡은 함께 음악을 만들며 꿈을 향해 나아가는 과정에서 느끼는 기쁨과 희망, 그리고 서로의 감정을 이해하고 지지하는 것의 중요성을 표현한다."
13,"새로운 시작과 미래에 대한 설렘과 희망이 가득한 감정으로, 변화를 맞이하는 일상 속에서 변하지 않는 것들을 지키며 앞으로 나아가는 내용을 담고 있다."
14,자신의 길을 걸어가는 과정에서 겪는 다양한 감정과 도전을 통해 자신만의 빛을 찾고 앞으로 나아가는 노래이다.
15,사랑과 추억이 가득한 순간들을 통해 永遠한 우정을 간직하고 앞으로도 함께하겠다는 마음을 표현한다.
16,이 곡은 기묘하고 엽기적인 상황 속에서 주인공이 다양한 감정을 경험하며 결국에는 행복한 결말을 맞이하는 내용을 담고 있다.
17,"삶의 여정에서 일어나는 모든 일들을 즐기고, 함께하는 사람들과의 시간을 소중히 여기며, 앞을 향해 나아가는 것의 중요성을 강조하는 노래이다."
18,"이 노래는 친구와 함께 즐거운 시간을 보내며, 추억을 만들고 서로의 우정을 깊게 하는 내용을 담고 있다."
19,"삶의 한계와 불확실성을 인식하면서도, 자신의 꿈과 희망을 위해 끊임없이 노력하고 자신을 믿어야 한다는 메시지를 전하는 노래이다."
20,"이 곡은 불안정한 현실과 꿈의 경계에서 방황하는 감정과, 잃어버린 사랑을 그리워하는 서사를 담고 있다."
21,삶의 열정과 자유를 찾아서 끊임없이 전진하는 젊은이들의 이야기
22,새로운 세계로 나아가기 위해 자신을 믿고 앞으로 나아가는 과정에서 느끼는 감정과 상황을 표현한다.
23,"두 사람이 서로를 향한 감정을 솔직하게 표현하고, 과거의 불안과 두려움을 극복하여 앞으로 나아가는 과정을 담은 노래이다."
24,어둠과 절망이 깔린 도시에서 희망을 찾고 앞으로 나아가는 감정과 서사가 담겨 있다.
25,어른이 된 후에도 자신의 꿈과 이상을 잃지 않으려는 노력과 그 과정에서 겪는 어려움을 표현하는 노래이다.
26,"진실과 비밀을 둘러싼 복잡한 감정과 상황 속에서, 서로를 믿고 지키려는 마음이 드러난다."
27,"두 사람이 서로의 마음을 이해하고, 앞으로 나아가며 희망을 찾는 과정을 담은 노래로, 사랑과 꿈, 그리고 어둠을 포함한 다양한 감정들이 복합적으로 표현된다."
28,"이 곡은 실패와 무력감, 그리고 그로 인한 절망과 혼란을 표현하며, 주인공은 자신의 상황을 비관하고 방황하는 모습을 보인다."
29,"이 곡은 자유와 평화를 찾는 여정에서 겪는 혼란과 방황, 그리고 사랑과 구원을 향한 갈망을 표현한다."
30,사랑과 자유를 찾아서 함께 달려가는 젊은이들의 열정과梦을 담은 노래이다.
31,"두 사람이 서로를 향한 마음을 가지고 있지만, 아직 서로에게 말하지 못하고 있는 상황을 표현한 노래로, 두 사람의 감정과 상황이 복雑하게 얽혀있다."
32,"젊은 시절의 꿈과 열정, 그리고 미래에 대한 불안과 두려움을 담은 노래로, 현재의 상황에 대한 불만과 미래에 대한 희망이 공존한다."
33,현실의 한계와 불확실성 속에서 꿈과 사랑을 향한 열망과 도전이 느껴지는 노래이다.
34,"잊을 수 없는 과거의 기억이 현재에 남아있는 곡으로, 과거의 사랑과 현재의 상실감이 공존한다."
35,"이 곡은 사랑하는 사람을 향한 깊은 감정과 함께, 두 사람의 관계를 지키고자 하는 의지와 희망을 담고 있다."
36,"이 곡은 강렬한 열정과 불멸의 의지로 가득 차 있으며, 현재의 순간을 열심히 살아가고자 하는 의지를 표현하고 있다."
37,"이 곡은 어려움과 불안함을 겪지만, 서로를 믿고 지지하며 앞으로 나아가는 것의 중요성을 강조하는 메시지를 담고 있다."
38,"자유롭고 무한한 미래를 향한 꿈과 희망이 가득한 가사로, 자신의 감정을 솔직하게 표현할 수 있는 곳에서 자신을 잃지 않고 앞으로 나아갈 수 있다는 내용이다."
39,"이 노래는 서로의 존재를 소중히 여기며, 함께하는 시간을 영원히 간직하고자 하는 마음을 담고 있다."
40,"과거의 잘못과 아픔을 인정하며, 앞으로의 미래를 향한 희망과 꿈을 노래한다."
41,"이 곡은 사랑하는 사람과 함께 행복한 삶을 보내며, 서로를 소중히 여기고 즐기며 살아가는 감정을 담고 있다."
42,"이 곡은 일상 속에서 특별함을 찾고, 친구와 함께하는 시간을 소중히 여기는 내용으로, 따뜻한 감정과 기쁨이 가득하다."
43,함께 앞으로 나아가며 서로의 마음을 이해하고 받아들이는 과정에서 느끼는 감정과 상황을 표현하는 노래이다.
44,"곡은 주인공이 자신의 꿈과 목표를 향해 전진하는 과정에서 겪는 다양한 감정과 경험을 다루고, 결국에는 자신의 길을 찾아나가는 이야기이다."
45,"이 노래는 현실과 이상의 세계 사이에서 방황하며 진실과 허구를 구분하지 못하는 혼란스러운 감정과, 자신이 속한 세계에 대한 불만과 불쾌감을 표현한다."
46,"이 곡은 불만과 혐오를 느끼는 감정으로 가득 차 있으며, 주인공은 자신의 감정을 표현하며 삶의 어려움과 불만을 표현한다."
47,"사랑의 시작과 끝을 담은 밤의 이야기, 사랑과 상실의 감정을 담고 있다."
48,"작별의 말도, 약속도 없이 다시 만날 수 있을지 모르는 채로, 오렌지 빛 지평선 아래서 웃고 울며 살아가는 젊은 날들을 회상하고 앞으로의 未来를 맞이한다."
49,어둠과 혼란이 가득한 여름의 날들 속에서 두 사람의 관계가 파국으로 치닫는 과정을 그린 노래이다.
50,"이 곡은 자신의 꿈과 희망을 위해 계속해서 노력하고, 실패와 어려움에도 불구하고 절대 포기하지 않으며, 자신을 믿고 앞으로 나아가는 강한 의지와 결심을 담고 있다."
51,"이 곡은 꿈과 현실의 괴리, 그리고 자신의 정체성과 목표를 찾는 과정에서 느끼는 혼란과 불안을 표현하며, 이를 통해 살아남기 위해 자신을 증명하고 인정받으려는 열망을 담고 있다."
52,"이 곡은 절망과 분노를 느끼며 모든 것을 잃어버리고 싶은 감정과, 그 속에서 찾아오는 비탄과 공허함을 표현한다."
53,"젊은 남녀의 앞을 향한 희망과 열정, 그리고 사랑과 고통의 감정이 교차하는 순간을 담은 노래이다."
54,"잃어버린 사랑과 그리움에 대한 아픔이 가득한 날들이 계속되며, 그 안에서 두 사람의 마음은 점점 더 멀어져 간다."
55,"이 곡은 꿈을 향해 열심히 싸우고 있는 젊은이들의 열정과 도전 정신을 표현하며, 현재를 살아가고 앞으로의 미래를 향한 도전을 담고 있다."
56,"이 곡은 과거의 관계를 회상하며, 다시 돌아갈 수 있다면 더 이상의 것을 바라는 것이 없다는 감정과, 현재의 혼란스러운 마음을 표현하며, 진실한 감정을 찾고자 하는 서사를 담고 있다."
57,어둠을 밝히는 희망과 사랑을 찾아 앞으로 나아가는 이야기
58,"과거의 약속이 현재를 지배하며, 진정한 감정을 찾고자 하는 마음이 담긴 곡으로서 사랑과 아픔의 감정이 교차한다."
59,"곡은 주변의 벽을 뚫고 앞으로 나아가기 위해 자신을 믿고 앞으로 나아가는 내용을 담고 있으며, 곡의 서사는 자신이 믿고 앞으로 나아가는 과정을 표현하고 있다."
60,"죽음과 삶의 의미에 대한 고민과矛盾을 안고 살아가는 젊은이들의 심경을 표현한 노래로, 죽음의 공포와 삶의 무의미함을 느끼면서도 살아가는 의지를 담고 있다."
61,과거의 기억과 약속을 지키며 앞으로 나아가는 의지와 결심이 담긴 노래이다.
62,"어둠을 비추는 빛은 우리가 익숙해진 일상과 길을 잃어버린 것 같은 느낌을 주며, 우리는 안정된 삶을 추구하지만 자극과 모험을 찾아 나서게 된다."
63,"이 곡은 어두운 분위기와 절망감을 담고 있으며, 주인공은 자신의 존재와 의미를 찾지 못하고 혼란스러워한다."
64,"삶의 어려움과 불안감을 느끼지만, 주변의 따뜻한 말과 지원으로 인해 희망과 용기를 얻어 앞으로 나아가는 과정을 표현한다."
65,"곡은 어둠과 절망이 가득한 상황에서 주인공이 자신의 감정을 직면하고, 고통과 두려움을 느끼며, 결국에는 새로운 시작을 향해 나아가는 과정을 표현한다."
66,"이 곡은 도시에서 외로움과 고립감을 느끼며, 자신을 이해해 줄 수 있는 누군가를 찾고 있지만, 그 답을 얻지 못하고 있는 상황을 표현한다."
67,"인생은 부족하고 답이 없는 것 같아, 고통과 후회가 가득한 삶을 살아가고 있다."
68,"이 곡은 자신의 본능과 열정을 따라가며, 때때로 휴식하지만 항상 전진하고자 하는 의지와 자신을 사랑하고 인정하는 중요성을 강조하는 내용이다."
69,함께 걸어온 시간과 경험을 통해 서로를 이해하고 지지하며 앞으로도 함께 가고 싶은 마음을 표현한다.
70,이 노래는 즐거운 밤을 보내며 무서운 것을 즐기는 감정과 함께 어린 시절의 환상과 꿈을 추구하는 이야기를 담고 있다.
71,"이 곡은 사랑하는 사람에게 감사의 마음을 표현하며, 함께하는 시간을 소중히 여기고 서로를 위해 최선을 다하는 감동적인 순간을 담고 있다."
72,"사랑과 상실의 아픔이 뒤섞인 곡으로, 사랑의 기쁨과 끝의 슬픔이 공존한다."
73,사랑과 자유의 갈망이 담긴 노래에서 주인공은 자신의 감정을 표현하며 제약과 규칙으로부터 벗어나고 싶어한다.
74,사랑하는 사람을 잃은 후에 남은 사람은 깊은 슬픔과 후회에 빠져서 그 사람을 다시 얻으려는 절실함을 느끼고 있다.
75,절망과 고통 속에서 생존을 위해 저항하고 있는 마음을 표현하는 노래이다.
76,"이 곡은 밤의 열기와 열정, 그리고 자유를 찾아서 자신의 본능을 따라가는 감정을 담고 있다."
77,"이 곡은 외로운 감정과 진정성의 부족을 표현하며, 가사 전체를 지배하는 감정은 외로움과 허무함이 서로 얽혀있다."
78,"미래로 향하는 동안 과거와 현재를 반추하며 잊어가는 과정을 담고, 새로운 시작을 향한 희망과 불안이 공존하는 감정을 표현한다."
79,"이 노래는 혼란과 불안정한 상황에서 빠져나가기 위해 절실하게 무언가를 찾고, 그 안에서 새로운 감정을 경험하며, 궁극적으로는 자신의 세계를 찾아가는 과정을 표현한다."
80,깊은 상상력과 감정의 세계에서 자신의 진정한 자아와 미래를 찾고자 하는 여정의 과정을 표현한다.
81,"이 노래는 어두운 분위기와 혼란스러운 감정으로 가득 차 있으며, 내면의 어둠과 외면의 환영 사이에서 방황하는 느낌을 전달한다."
82,불확실한 상황에서 의미와 정의를 찾으려는 노력과 그로 인한 혼란과 고통이 담겨 있다.
83,"이 노래는 어둠과 혼란 속에서 자유와 해방을 찾는 감정과, 그 속에서 느끼는 황홀함과 열정의 감정을 담고 있다."
84,어둠과 환희가 뒤섞인 세계에서 기쁨과 고통을 함께하는 감정의 혼합이 느껴진다.
85,"곡은 과거의 기억과 상실에 대한 아픔을 담고 있으며, 주인공은 자신의 존재와 의미를 찾고자 하는 열망을 표현한다."
86,"사랑과 상실, 그리고 무의미함에 대한 감정이 복합적으로 얽혀있는 곡으로, 주인공은 사랑의 의미를 찾고자 하지만 결국은 허무함에 빠져버린다."
87,"사랑과 시간의 흐름이 교차하며, 과거와 현재의 감정이 뒤섞인 세계에서 사랑의 불꽃이舞い上がる 순간을 그리며, 행복한 날의 訪れ를 기다리는 마음을 표현한다."
88,"새로운 시작과 성장을 위한 준비와 희망이 가득한 순간을 표현하는 노래로, 삶의 변화를 받아들이고 앞으로 나아가는 감정을 담고 있다."
89,"삶의 진정한 의미와 가치를 찾는 여정에서 자신의 본질과 빛을 발견하고, 그 빛을 통해 자신을 실현하는 과정을 표현한다."
90,"삶의 短さ와 불확실성에 대한 아픔과 절망이 가득한 곡으로, 주변의 모든 것에 대한 불신과 혼란이 느껴진다."
91,"이별을 앞둔 두 사람의 마음이 어지러워지며, 서로를 믿고 사랑하는 가운데도 결국은 이별을 선택하게 되는 과정을 표현한다."
92,"이 노래는 자신의 이상향을 향해 나아가기 위해 끊임없이 노력하고 도전하는 과정을 표현하며, 그 과정에서 느끼는 감정의 복잡함과 혼란을 담고 있다."
93,"자유롭고 열린 마음으로 새로운 경험과 감정을 추구하며, 진지함을 버리고 삶의 즐거움을 찾는 과정에서 사랑과 희망이 피어나는 이야기이다."
94,이 노래는 어둠과 혼란이 가득한 세계에서 사랑과 진실을 찾아가는 여정의 감동을 담고 있다.
95,"이 곡은 사랑과 欲望의 혼란스러운 감정으로 가득 차 있으며, 상대방에게서 벗어나고 싶지만 끌리는 감정의 충돌을 표현한다."
96,"이 곡은 꿈과 현실의 경계를 넘나들며 자신의 길을 믿고 앞으로 나아가는 용기를 담은 노래로, 자유와 열정, 그리고 진실한 감정을 찾아가는 여정의 감동을 전한다."
97,현실을 깨닫고 사랑의 의미를 찾으려는 노력과 그 속에서 겪는 고통과 혼란이 담긴 노래이다.
98,"두 사람이 서로를 향한 감정과 비밀을 공유하며 점점 더 깊은 관계로 빠져드는 과정을 표현하는 노래로, 그들의 감정과 상황이 복잡하게 얽혀있다."
99,"이 곡은 강렬한 감정과 충돌을 담고 있으며, 두 사람의 관계에서 서로를 끌어당기고 파괴하는 과정을 표현하고 있다."
100,"곡은 어둠과 고통, 그리고 절망이 가득한 세계에서 사랑과 자유를 찾아가는 이야기로, 주인공은 자신의 존재와 사랑을 찾기 위해 끊임없이 투쟁한다."
101,이 노래는 처음 만난 사람에 대한 설렘과 두 사람의 미래를 향한 희망을 담고 있다.
102,"밝고 강한 사랑과 미래에 대한 희망이 가득한 노래로, 두 사람의 마음이 하나되어 앞으로 나아가는 모습을 그린다."
103,꿈을 믿고 앞으로 나아가며 자신의 리듬을 찾아가는 과정에서 느끼는 감정과 도전적인 상황이 담겨 있다.
104,"이 노래는 밝고 활기찬 분위기에서 꿈과 희망을 찾으며, 삶의 즐거움과 함께함을 강조하는 내용을 담고 있다."
105,"삶의 여정에서 친구와 함께하면 어려움도 즐길 수 있고, 약속을 지키며 앞으로 나아가면 새로운景色과 자신감을 얻을 수 있다."
106,"함께하는 시간이 행복하고 소중하며, 그 시간을 함께하는 사람들이 없으면 아무것도 시작할 수 없다는 감정을 표현하는 노래이다."
107,"이 곡은 친구와 함께하는 모험과 그 속에서 느끼는 즐거움, 설렘을 표현하며, 항상 새로운 경험과 도전을 추구하는 마음을 담고 있다."
108,어린 시절의 즐거운 추억과 함께 미래를 향한 희망과 기대가 가득한 마음을 표현한다.
109,"이 노래는 밝고 행복한 분위기로 가득 차 있으며, 모두가 함께 즐기고 행복한 감정을 나누는 것을 강조한다."
110,"이 노래는 학교 축제의 즐거움과 청춘의 기쁨을 표현하며, 모든 사람이 주인공이 되어 즐기고笑い하며 살아갈 것을 권유한다."
111,"이 곡은 밝고 행복한 분위기에서 시작하여, 사람들을 웃게 하고 행복하게 만드는 것의 중요성을 강조하며, 결국에는 모두가 함께 웃고 행복해지는 장면을 그린다."
112,"이 곡은 상대방과의 만남과 함께 시작된幸せ한 감정과 사랑을 표현하며, 두 사람의 관계가 변하지 않는다는 것을 강조한다."
113,"이 노래는 밤의 도시에서 두 사람의 긴장감과 도전적인 분위기를 담고 있으며, 상대방을 향한 집착과 도피의 감정이 교차한다."
114,"이 곡은 삶의 도전과 즐거움을 담고 있으며, 자신감과勇気를 가지고 앞으로 나아가는 것을 권장하는 메시지를 전달한다."
115,"이 노래는 밝고 활기찬 분위기에서 시작하여, 모두가 함께 손잡고 하나가 되는 감정을 표현하며, 서로의 마음을 하나로 모으는 감동을 전달한다."
116,"따뜻한 마음과 감사의 감정이 가득한 노래로, 상대방에게 받은 사랑과 행복이 주는 기쁨과 감사를 표현한다."
117,"이 곡은 세계를 행복과 웃음으로 채우고, 상대방을 기쁘게 만들기 위해 노력하는 내용을 담고 있다."
118,"이 곡은 새로운 경험과 도전을 통해 행복과 기쁨을 찾는 내용으로, 주변의 부정적인 목소리에 귀를 닫고 자신이 원하는 것을 추구하라는 메시지를 담고 있다."
119,"이 노래는 밝고 활기찬 분위기에서 시작하여, 상대방을 향한 감사의 마음과 함께 꿈을 향해 나아가는 희망과 자신감을 담고 있다."
120,"이 노래는 자유롭고 행복한 감정으로 가득 차 있으며, 자신을 표현하고 즐기는 것을 중요하게 생각하는 메시지를 전달한다."
121,"이 곡은 기쁨과 안정감을 느끼며, 어려움을 극복하고 앞으로 나아가는 내용을 담고 있다."
122,환상적인 세계에서 행복과 즐거움을 느끼며 꿈꾸는 장면이 펼쳐진다.
123,"이 노래는 하루하루의 일상과 작은 기쁨을 즐기며 행복을 찾는 내용으로, 밝고 경쾌한 분위기로 가득 차 있다."
124,"이 곡은 대도적의 매력과 재능을 보여주며, 그들이 남긴 감동과 추억을 통해 사람들의 마음을 사로잡는 이야기를 담고 있다."
125,"힘든 상황에서도 용기를 내서 앞으로 나아가고, 실패해도 상처를 딛고 다시 도전하는 마음을 표현하는 노래이다."
126,새해를 맞아 설렘과 사랑으로 가득한 행복을 함께 나누며 감사와 희망을 전하는 노래이다.
127,그 사람에 대한 깊은 사랑과 감사가 미래를 향한 희망과 용기로 이어지는 이야기이다.
128,"스스로의 한계를 깨고 용기를 내어 희망을 찾으며, 모든 이가 가지고 있는 힘으로 슬픔을 이겨내고 행복을 향해 나아가는 이야기"
129,당신만이 할 수 있는 일을 시작해 밝고 행복한 미래를 함께 향해 나아가는 이야기다.
130,소중한 사람을 만나 사랑을 키우고 부모에게 감사함을 전하며 성장해가는 따뜻한 이야기.
131,그는 눈물 흘리는 연인을 위로하고 함께 성장하며 진정한 행복을 찾아 나아가는 따뜻한 사랑과 희망을 전한다.
132,빛나는 바람을 쫓으며 색채 가득한 기대와 용기로 사랑하는 사람과의 만남을 향해 나아가는 이야기
133,화려한 빛과 무한한 어둠 사이에서 갈등하며 파괴적인 열정과 불안한 욕망을 동시에 추구하는 혼란스러운 내면을 드러낸다.
134,"새로운 만남과 작은 변화가 퍼즐처럼 맞춰지며, 서로의 존재가 세상을 밝히는 마법 같은 성장과 희망을 그린다."
135,시련을 넘어 끊임없이 전진하며 미래와 가능성을 믿는 청춘의 결단과 열정이다.
136,삶의 진흙 같은 고통과 외로움 속에서도 과거의 열정과 순수를 되찾아 새로운 빛으로 자신을 정화하려는 갈망을 담은 이야기다.
137,"자신을 알아주지 못하는 외로움 속에서 사랑과 성장에 대한 갈망을 품지만, 그 과정에서 겪는 쓴맛과 눈물로 복잡한 슬픔을 드러낸다."
138,"서로에게 기대며 설레는 감정을 나누고, 함께 꿈을 향해 나아가는 사랑과 희망을 품는다."
139,함께 모험을 떠나며 설렘과 즐거움으로 가득 찬 순간들을 나누는 이야기
140,친구와 함께 자유롭게 즐거운 순간을 만끽하며 행복을 나누는 노래
141,여름 햇살 가득한 해변에서 친구와 함께 신나게 뛰놀며 자유롭고 행복한 순간을 만끽한다.
142,"서로를 위한 웃음과 약속을 품고, 멀리 떨어져도 끊임없이 앞으로 나아가며 다시 만날 날을 믿는 이야기다."
143,현재 순간을 온전히 즐기며 자신을 믿고 무한한 가능성을 향해 나아가는 활기찬 격려의 메시지
144,"무대가 열리고 서로를 격려하며 어려움을 이겨내는 가운데, 함께 노래하고 감사함을 나누는 이야기"
145,"우리는 서로의 웃음과 사랑으로 언제든 힘을 주고, 함께라면 어떤 꿈도 이룰 수 있다."
146,"새로운 시작을 향한 설렘과 자신감으로 가득 차, 스스로를 믿으며 앞으로 나아가는 이야기"
147,"서로에게 진심을 전하고 함께 성장하며, 어려움 속에서도 믿음과 감사로 앞으로 나아가려는 마음"
148,"서로를 믿으며 어려움을 극복하고, 함께 웃음과 꿈을 향해 나아가는 이야기"
149,서로를 향한 따뜻한 음악과 사랑으로 외로움을 이겨내며 함께 웃는 미래를 약속한다.
150,"특별한 겨울날, 사람들은 손을 맞잡고 웃음과 선물을 나누며 따뜻한 행복을 되새긴다."
151,"친구와 함께하는 모든 순간이 웃음과 행복으로 가득 차, 언제나 새롭고 따뜻한 추억을 만들어가는 이야기다."
152,청춘의 혼란 속에서 그리운 사람에게 다가가려는 설렘과 불안이 뒤섞인 이야기다.
153,권력 욕망에 사로잡힌 화자는 복수와 파멸을 꿈꾸며 적들을 무자비하게 처단하려는 분노와 냉소를 드러낸다.
154,함께 있을 때 느끼는 무질서한 즐거움과 서로에게 끈끈히 기대는 감정이 뒤섞인 이야기
155,"다른 사람을 위해 기꺼이 나서지만, 끊임없이 떠오르는 어두운 기억과 불안을 마주하며 희망을 찾아 나아가는 갈등의 여정이다."
156,청춘의 혼란 속에서도 운명과 자유를 향한 활기찬 열정을 노래한다.
157,"시작은 좋았지만 강한 바람과 갈등에 가로막혀 전진하지 못하고, 좌절 속에서 평온함을 갈망한다."
158,과거의 상처를 딛고 약함을 힘으로 삼아 다시 일어나 앞으로 나아가는 결연한 부활의 이야기
159,복잡하고 어수선한 생각들 속에서 사랑에 대한 설렘과 불안이 뒤섞인 청춘의 혼란을 그린다.
160,"꿈같은 보물섬을 향한 희망적인 여정을, 소중한 사람과 함께 조심스럽게 그려 나가는 이야기다."
161,"어려운 길을 넘어 자신과 타인을 향한 노래로 서로를 연결하고, 모두가 함께 웃으며 세상을 돌리는 희망적인 여정을 그린다."
162,"자신이 느끼는 불안과 허무 속에서 진정한 행복을 찾으려 애쓰지만, 끊임없는 두려움과 고독에 사로잡힌 채 방황한다."
163,주인공이 상대에게 전적으로 헌신하며 영원히 함께하겠다는 강렬한 사랑과 보호를 약속한다.
164,두 사람은 서로를 외계 존재처럼 느끼며 혼란스러운 감정 속에서 깊은 사랑과 갈망을 나눈다.
